title,rating,runtime,imdb_rating,meta_score,genre,release_year,description,director,stars,votes,gross,img_src,type,stars_list,genre_list,rating_norm,runtime_norm
My Christmas Inn,TV-G,100.0,5.6,,"Comedy, Drama, Romance",2018.0,A big city advertising executive inherits her great-aunt's inn and heads to the small Alaskan town where it's located to get it ready for sale.,Peter Sullivan,"Tia Mowry, Rob Mayes, Jackée Harry, Tim Reid, ","2,415",,"https://m.media-amazon.com/images/M/MV5BMDk0N2IzODAtODU0NS00MmViLTkwZGUtZWFiNmYzMzE0ZDg3XkEyXkFqcGdeQXVyMTU0NjY0NDg@._V1_UY209_CR11,0,140,209_AL_.jpg",Movie,"['Tia Mowry', 'Rob Mayes', 'Jackée Harry', 'Tim Reid']","['Comedy', 'Drama', 'Romance']",0.5443037974683544,0.5
Once Upon a Main Street,TV-PG,87.0,6.3,,"Comedy, Drama, Romance",2020.0,"Amelia, who wants to open a year-round Christmas store, bids for a shop lot against Vic, who wants to open a chocolate shop. Rivalry becomes romance when they must work together.",Polly Draper,"Vanessa Lachey, Ryan McPartlin, Polly Draper, Scott Takeda, ",828,,"https://m.media-amazon.com/images/M/MV5BMDhiYmMzNjctYTM2MC00ZmQ2LTk5MGMtNDc3ZjdlZTRlODkwXkEyXkFqcGdeQXVyNjU0NTI0Nw@@._V1_UX140_CR0,0,140,209_AL_.jpg",Movie,"['Vanessa Lachey', 'Ryan McPartlin', 'Polly Draper', 'Scott Takeda']","['Comedy', 'Drama', 'Romance']",0.6329113924050633,0.43434343434343436
Steppin' Into the Holiday,,87.0,6.4,,"Comedy, Romance",2022.0,"Follows former Broadway star, Billy Holiday, who meets Rae, the charismatic owner of a local dance studio, and after Billy volunteers to help Rae with a dance recital fundraiser, their collaboration clicks and romantic sparks start flying.",David Kendall,"Mario Lopez, Jana Kramer, Terri Hoyos, Stefanie Black, ",730,,"https://m.media-amazon.com/images/M/MV5BZmIzZDMwZjAtZTU5MC00MzEzLThiYTQtYzQxMDA1ZDQ5NDk3XkEyXkFqcGdeQXVyNjEzOTQ5MQ@@._V1_UY209_CR34,0,140,209_AL_.jpg",Movie,"['Mario Lopez', 'Jana Kramer', 'Terri Hoyos', 'Stefanie Black']","['Comedy', 'Romance']",0.6455696202531647,0.43434343434343436
Christmas with Tucker,Not Rated,87.0,6.7,,"Drama, Family",2013.0,A young boy learns to be a man after the death of his father and forms a special bond with a dog.,Larry A. McLean,"James Brolin, Gage Munroe, Barbara Gordon, Ron Lea, ",711,,"https://m.media-amazon.com/images/M/MV5BZmE3YTkxZmEtNmM5NS00YmM3LWE4ZDMtYzVhYzU4MTU3OTQ0XkEyXkFqcGdeQXVyNDkzOTg1NA@@._V1_UY209_CR8,0,140,209_AL_.jpg",Movie,"['James Brolin', 'Gage Munroe', 'Barbara Gordon', 'Ron Lea']","['Drama', 'Family']",0.6835443037974684,0.43434343434343436
Christmas on the Menu,TV-PG,88.0,6.3,,"Comedy, Drama, Romance",2020.0,"Celebrated chef Josie heads home for the holidays and creates a special festive menu for her mom's new bed-and-breakfast bistro, where she runs into Tanner, the famous food critic who ...                See full summary »",Jake Helgren,"Kim Shaw, Clayton James, Cynthia Gibb, Katrina Norman, ",698,,"https://m.media-amazon.com/images/M/MV5BN2RmN2UwYWQtMDJjYy00MTUzLWEyMTAtYzcwYTJhZDQzMzk4XkEyXkFqcGdeQXVyMTQyODAxMw@@._V1_UX140_CR0,0,140,209_AL_.jpg",Movie,"['Kim Shaw', 'Clayton James', 'Cynthia Gibb', 'Katrina Norman']","['Comedy', 'Drama', 'Romance']",0.6329113924050633,0.4393939393939394
A Candy Cane Christmas,TV-PG,91.0,5.6,,"Comedy, Drama, Romance",2020.0,"As Phoebe is searching for a new tradition to lift her holiday spirits, she realizes that it's not the traditions we cherish, but the people with whom we share them.",Adrian Langley,"Beverley Mitchell, Mark Ghanimé, Derek Johns, Benedicte Belizaire, ",755,,"https://m.media-amazon.com/images/M/MV5BMWM1NmUwNGYtZDRhYi00Zjg2LWIwYjQtN2E1ODUyOTQzN2E1XkEyXkFqcGdeQXVyMTQyNDk2NzE@._V1_UY209_CR2,0,140,209_AL_.jpg",Movie,"['Beverley Mitchell', 'Mark Ghanimé', 'Derek Johns', 'Benedicte Belizaire']","['Comedy', 'Drama', 'Romance']",0.5443037974683544,0.45454545454545453
Christmas Eve,PG,95.0,5.0,24.0,Comedy,2015.0,"Hilarity, romance, and transcendence prevail after a power outage traps six different groups of New Yorkers inside elevators on Christmas Eve.",Mitch Davis,"Patrick Stewart, Jon Heder, James Roday Rodriguez, Cheryl Hines, ","2,796",,"https://m.media-amazon.com/images/M/MV5BMTY0MjEyMzQ1Nl5BMl5BanBnXkFtZTgwMTEwMjkxNzE@._V1_UY209_CR1,0,140,209_AL_.jpg",Movie,"['Patrick Stewart', 'Jon Heder', 'James Roday Rodriguez', 'Cheryl Hines']",['Comedy'],0.4683544303797469,0.47474747474747475
The Lemon Drop Kid,Approved,91.0,7.0,,"Comedy, Crime, Music",1951.0,"A New York City swindler has until Christmas to come up with the $10,000 he owes a gangster, prompting him to go into scamming overdrive.",Sidney Lanfield,"Frank Tashlin, Bob Hope, Marilyn Maxwell, Lloyd Nolan, Jane Darwell, ","2,206",,"https://m.media-amazon.com/images/M/MV5BOWI0MDljNjAtMDc0MS00MDI0LWI5M2YtNjQ5Yjc5NTYyZWIxXkEyXkFqcGdeQXVyMTMxMTY0OTQ@._V1_UX140_CR0,0,140,209_AL_.jpg",Movie,"['Frank Tashlin', 'Bob Hope', 'Marilyn Maxwell', 'Lloyd Nolan', 'Jane Darwell']","['Comedy', 'Crime', 'Music']",0.7215189873417722,0.45454545454545453
Once Upon a Holiday,TV-G,84.0,6.2,,"Comedy, Drama, Romance",2015.0,"When a Princess escapes her entourage to explore New York City over Christmas, she meets a young man who shows the beautiful stranger his side of the city.",James Head,"Briana Evigan, Paul Campbell, Greg Evigan, Jacqueline Samuda, ","3,515",,"https://m.media-amazon.com/images/M/MV5BNjE2NWNmNTMtNzdhMi00YzhkLTkzMzYtN2IwYzk4YTI0YjBmXkEyXkFqcGdeQXVyNzk0NTA5NQ@@._V1_UY209_CR4,0,140,209_AL_.jpg",Movie,"['Briana Evigan', 'Paul Campbell', 'Greg Evigan', 'Jacqueline Samuda']","['Comedy', 'Drama', 'Romance']",0.6202531645569621,0.41919191919191917
A Very Corgi Christmas,,90.0,5.4,,"Drama, Family, Romance",2019.0,"Single dad Ben needs help to keep a Christmas gift a secret from his daughter, and that gift is an adorable Corgi puppy! When he meets single mom Lauren he shows her the importance of family and spending time with the people you love.",Andrew Cymek,"Kelly Kruger, Kevin McGarry, Davide Fair, Ariella Cannon, ",710,,"https://m.media-amazon.com/images/M/MV5BYmI3NDkwMTYtYTQ4Mi00MjcwLTg3MWMtN2M1MGVmMjQ0YmQxXkEyXkFqcGdeQXVyMTA3NDA4OTk2._V1_UX140_CR0,0,140,209_AL_.jpg",Movie,"['Kelly Kruger', 'Kevin McGarry', 'Davide Fair', 'Ariella Cannon']","['Drama', 'Family', 'Romance']",0.518987341772152,0.4494949494949495
The Perfect Christmas Present,TV-G,82.0,6.3,,"Drama, Romance",2017.0,"Tom is called Mr. Christmas due to his ability to determine the perfect Christmas gift for someone, befitting their personality.",Blair Hayes,"Sam Page, Tara Holt, Sam Guinan-Nyhart, Emily Peterson, ","1,859",,"https://m.media-amazon.com/images/M/MV5BYTI3OTQ2NmEtNWQwMi00OTBhLTg1ZDAtYzA2MTVhZGQwNmNlXkEyXkFqcGdeQXVyMjAzMjcxNTE@._V1_UX140_CR0,0,140,209_AL_.jpg",Movie,"['Sam Page', 'Tara Holt', 'Sam Guinan-Nyhart', 'Emily Peterson']","['Drama', 'Romance']",0.6329113924050633,0.4090909090909091
Christmas for a Dollar,PG,101.0,7.0,,"Drama, Family",2013.0,A family struggling to get by during the Depression expects another presentless Christmas until the father brings home a dollar for them to spend on presents.,John Lyde,"Brian Krause, Nancy Stafford, Danielle C. Ryan, Heather Beers, ",691,,"https://m.media-amazon.com/images/M/MV5BMjA0NTE3Mjk5Ml5BMl5BanBnXkFtZTgwODU3NTkxNzE@._V1_UY209_CR8,0,140,209_AL_.jpg",Movie,"['Brian Krause', 'Nancy Stafford', 'Danielle C. Ryan', 'Heather Beers']","['Drama', 'Family']",0.7215189873417722,0.5050505050505051
Ghosts of Christmas Past,,87.0,6.4,,"Comedy, Romance",2021.0,Ellie is told by a fortune teller that she must resolve her past and make amends with all of those she ghosted before Christmas and discovers love in the process.,Virginia Abramovich,"Annie Clark, Dan Jeannotte, Morgan David Jones, Connie Wang, ",725,,"https://m.media-amazon.com/images/M/MV5BMjI1OGJjZGMtZDZjMi00Y2Y2LThhYzAtOTFiOTA2MjAyZGZlXkEyXkFqcGdeQXVyMjIzOTA2NDk@._V1_UX140_CR0,0,140,209_AL_.jpg",Movie,"['Annie Clark', 'Dan Jeannotte', 'Morgan David Jones', 'Connie Wang']","['Comedy', 'Romance']",0.6455696202531647,0.43434343434343436
A Country Christmas Story,Not Rated,120.0,6.3,,"Drama, Family, Musical",2013.0,A teenage chorister from a small Appalachian town dreams of becoming a country music star.,Eric Bross,"Megyn Price, Ross McCall, Brian McKnight, Desiree Ross, ",672,,"https://m.media-amazon.com/images/M/MV5BNjFlOGI1ZDEtYzhhZC00YmYxLWJlMDUtMTY2ZDMxOTMwYzA4XkEyXkFqcGdeQXVyMTM2ODk1OTQ@._V1_UY209_CR8,0,140,209_AL_.jpg",Movie,"['Megyn Price', 'Ross McCall', 'Brian McKnight', 'Desiree Ross']","['Drama', 'Family', 'Musical']",0.6329113924050633,0.601010101010101
Under the Christmas Tree,TV-PG,87.0,5.7,,"Drama, Romance",2021.0,"Alma and Charlie cross paths with each other, when Charlie finds the perfect tree for the Maine Governor's Holiday Celebration right in Alma's back yard.",Lisa Rose Snow,"Elise Bauman, Tattiawna Jones, Wendy Crewson, Enrico Colantoni, ",905,,"https://m.media-amazon.com/images/M/MV5BODRkY2NmMmItYjM4MS00OTllLWEzZWEtNjVkNjBlNDJjN2NiXkEyXkFqcGdeQXVyMjIzOTA2NDk@._V1_UX140_CR0,0,140,209_AL_.jpg",Movie,"['Elise Bauman', 'Tattiawna Jones', 'Wendy Crewson', 'Enrico Colantoni']","['Drama', 'Romance']",0.5569620253164558,0.43434343434343436
Christmas at the Palace,TV-G,85.0,6.3,,Romance,2018.0,A king who is struggling to live up to his father's name hires an ice skating choreographer for a special Christmas Eve performance to celebrate the founding of his nation.,Peter Hewitt,"Merritt Patterson, Andrew Cooper, Brittany Bristow, Nicholas Banks, ","2,502",,"https://m.media-amazon.com/images/M/MV5BMWM3NmVhYTUtYjdjMS00NGZmLWFiMmEtMGMxNDRjMTc3Njg5XkEyXkFqcGdeQXVyODA4MzkyNjM@._V1_UX140_CR0,0,140,209_AL_.jpg",Movie,"['Merritt Patterson', 'Andrew Cooper', 'Brittany Bristow', 'Nicholas Banks']",['Romance'],0.6329113924050633,0.42424242424242425
Merry Liddle Christmas,TV-G,87.0,5.9,,"Comedy, Drama, Romance",2019.0,A woman trying to get her dysfunctional family to look picture-perfect for the holidays falls in love with her neighbor amid the chaos.,Bosede Williams,"Thomas Cadrot, Jaime M. Callica, Thalia Campbell, Jeff Gonek, ",673,,"https://m.media-amazon.com/images/M/MV5BYmI3ZDg1MDgtNjQzYi00ZDI2LTk2OGMtMDcyZjYzMjYxYjdiXkEyXkFqcGdeQXVyNTQ2NjI3NDQ@._V1_UY209_CR0,0,140,209_AL_.jpg",Movie,"['Thomas Cadrot', 'Jaime M. Callica', 'Thalia Campbell', 'Jeff Gonek']","['Comedy', 'Drama', 'Romance']",0.5822784810126583,0.43434343434343436
Finding Father Christmas,TV-G,86.0,6.8,,"Drama, Romance",2016.0,"Raised by her mother, but orphaned at a young age at Christmas, Miranda finds a clue that will take her to the truth about her father. Along the way, she finds romance and rekindles her Christmas spirit.",Terry Ingram,"Erin Krakow, Niall Matter, P. Lynn Johnson, Michael Kopsa, ","2,584",,"https://m.media-amazon.com/images/M/MV5BYjgyNjgzYmQtYjFlZi00NGMxLWJlOWEtY2QyNDUwN2IzYTE5L2ltYWdlL2ltYWdlXkEyXkFqcGdeQXVyNzk0NTA5NQ@@._V1_UX140_CR0,0,140,209_AL_.jpg",Movie,"['Erin Krakow', 'Niall Matter', 'P. Lynn Johnson', 'Michael Kopsa']","['Drama', 'Romance']",0.6962025316455697,0.4292929292929293
One Christmas Eve,TV-G,86.0,6.1,,"Comedy, Drama, Family",2014.0,"A series of mishaps threaten a recently divorced mom's attempts to make her two kids' first Christmas ""without dad"" perfect.",Jay Russell,"Anne Heche, Kevin Daniels, Carlos Gómez, Griffin Kane, ","1,607",,"https://m.media-amazon.com/images/M/MV5BN2FmNGZkYzYtYTc1MC00MDVjLThkOTMtMjQzZTgyMWEwODM5XkEyXkFqcGdeQXVyNTU2MDQyOTk@._V1_UX140_CR0,0,140,209_AL_.jpg",Movie,"['Anne Heche', 'Kevin Daniels', 'Carlos Gómez', 'Griffin Kane']","['Comedy', 'Drama', 'Family']",0.6075949367088608,0.4292929292929293
It Takes a Christmas Village,TV-PG,87.0,6.5,,"Comedy, Romance",2021.0,"When road construction threatens to close the town's shops, the mayor offers a Christmas market to boost sales, but she needs to convince reclusive Darcy to host it at his family's mill, reigniting old feuds while also sparking romance.",Corey Sevier,"Brooke Nevin, Corey Sevier, Alli Chung, Lynne Griffin, ",536,,"https://m.media-amazon.com/images/M/MV5BMzE1M2I0NGMtYzkyOS00MDYwLTlmNmQtOTgxOTEzYTI0MTE1XkEyXkFqcGdeQXVyNjMzMjU5NTk@._V1_UY209_CR8,0,140,209_AL_.jpg",Movie,"['Brooke Nevin', 'Corey Sevier', 'Alli Chung', 'Lynne Griffin']","['Comedy', 'Romance']",0.6582278481012659,0.43434343434343436
A Christmas Exchange,TV-PG,87.0,6.0,,"Drama, Romance",2020.0,"This holiday season, Molly Cooper swaps her snow covered farmhouse for Patrick Kensington's posh London apartment. While enjoying Christmas time in the UK, Molly begins to look forward to ...                See full summary »",Justin G. Dyck,"Laura Vandervoort, Rainbow Sun Francks, Yanic Truesdale, Martin Roach, ",658,,"https://m.media-amazon.com/images/M/MV5BZDY3NDUwZjUtYzA4MS00ZWNjLWExMmUtMDBiMTA4N2JlZTViXkEyXkFqcGdeQXVyNjI4Mzg5OTg@._V1_UY209_CR2,0,140,209_AL_.jpg",Movie,"['Laura Vandervoort', 'Rainbow Sun Francks', 'Yanic Truesdale', 'Martin Roach']","['Drama', 'Romance']",0.5949367088607596,0.43434343434343436
A Christmas Detour,TV-G,85.0,6.1,,"Comedy, Romance",2015.0,"An anxious bride-to-be throws in with a broken-hearted guy and a happily married couple for an emergency ride to NYC, learning about each other and themselves along the way.",Ron Oliver,"Candace Cameron Bure, Paul Greene, Sarah Strange, David James Lewis, ","3,391",,"https://m.media-amazon.com/images/M/MV5BYjAyYzEyZGYtNDJlZC00YjcxLTlhNjYtZTk1NjI2MDlmMGQ0XkEyXkFqcGdeQXVyNzk0NTA5NQ@@._V1_UY209_CR6,0,140,209_AL_.jpg",Movie,"['Candace Cameron Bure', 'Paul Greene', 'Sarah Strange', 'David James Lewis']","['Comedy', 'Romance']",0.6075949367088608,0.42424242424242425
Christmas in Homestead,TV-G,84.0,6.6,,Romance,2016.0,Life is turned upside down for a small town mayor when a famous actress arrives to shoot her new Christmas movie.,Steven R. Monroe,"Taylor Cole, Michael Rady, Brooklyn Rae Silzer, Jeff Branson, ","2,668",,"https://m.media-amazon.com/images/M/MV5BODFiOGUwZDQtZjRjNi00MjIyLTgyYjUtYzNiM2Y0NjI1MDBkL2ltYWdlL2ltYWdlXkEyXkFqcGdeQXVyMDE2Mjc2OA@@._V1_UX140_CR0,0,140,209_AL_.jpg",Movie,"['Taylor Cole', 'Michael Rady', 'Brooklyn Rae Silzer', 'Jeff Branson']",['Romance'],0.6708860759493671,0.41919191919191917
Christmas Break-In,,87.0,4.5,,Family,2018.0,"Izzy is an energetic 9-year-old girl. Overscheduled and running late, her parents can't pick her up on time on the last day of school before Christmas break. A blizzard complicates this ...                See full summary »",Michael Kampa,"Danny Glover, Denise Richards, Cameron Seely, Sean O'Bryan, ","1,691",,"https://m.media-amazon.com/images/M/MV5BOThjZGRkZTEtZDliZi00OTgxLWExODUtMTljOTEwYTNhNTA2XkEyXkFqcGdeQXVyNDI3OTc1MDk@._V1_UY209_CR0,0,140,209_AL_.jpg",Movie,"['Danny Glover', 'Denise Richards', 'Cameron Seely', ""Sean O'Bryan""]",['Family'],0.40506329113924056,0.43434343434343436
A Royal Christmas Engagement,,86.0,4.9,,"Family, Romance",2020.0,"Lauren, a hard-working advertising executive, begins to fall for Paul, a consultant she has been paired with to land a big account for the upcoming holiday season. Unbeknownst to Lauren and...                See full summary »",Fred Olen Ray,"Paige Bach, James Nitti, Louie Chapman, Samantha Dawson, ",488,,"https://m.media-amazon.com/images/M/MV5BMmY1Y2MyMWEtOTUwOS00NzZlLWJlODEtYzMyMjFmYmUxNTgwXkEyXkFqcGdeQXVyMTU0NjY0NDg@._V1_UY209_CR12,0,140,209_AL_.jpg",Movie,"['Paige Bach', 'James Nitti', 'Louie Chapman', 'Samantha Dawson']","['Family', 'Romance']",0.45569620253164567,0.4292929292929293
Christmas in Evergreen: Letters to Santa,TV-G,84.0,6.6,,"Drama, Fantasy, Romance",2018.0,Lisa Palmer's trip home to Evergreen for the holidays finds her fulfilling the wishes of a Christmas Past and finding a romance full of Christmas magic. Stars Jill Wagner and Mark Deklin.,Sean McNamara,"Jill Wagner, Mark Deklin, Holly Robinson Peete, Barbara Niven, ","2,105",,"https://m.media-amazon.com/images/M/MV5BNzExY2NkYTItYTg4NC00YmJlLTlhOWYtYTcxYWU1ODBhZTUxXkEyXkFqcGdeQXVyNzg0MDM4NTc@._V1_UX140_CR0,0,140,209_AL_.jpg",Movie,"['Jill Wagner', 'Mark Deklin', 'Holly Robinson Peete', 'Barbara Niven']","['Drama', 'Fantasy', 'Romance']",0.6708860759493671,0.41919191919191917
Sweet Mountain Christmas,TV-G,88.0,6.3,,Romance,2019.0,"As country-music star Laney Blu spends more time in her hometown, it becomes less and less like she remembered it.",David Weaver,"Megan Hilty, Marcus Rosner, Teryl Rothery, Kate Craven, ",702,,"https://m.media-amazon.com/images/M/MV5BZDEyYTVhNzEtZmJkNS00NGM4LTlhZmItMTg1Y2RmODJmNDM1XkEyXkFqcGdeQXVyNTQ2NjI3NDQ@._V1_UX140_CR0,0,140,209_AL_.jpg",Movie,"['Megan Hilty', 'Marcus Rosner', 'Teryl Rothery', 'Kate Craven']",['Romance'],0.6329113924050633,0.4393939393939394
Christmas in Vienna,TV-G,83.0,6.4,,"Drama, Family, Romance",2020.0,"Jess, a concert violinist whose heart just isn't in it anymore, goes to Vienna for a performance. While there, she finds the inspiration she has been missing, and a new love.",Maclain Nelson,"Sarah Drew, Brennan Elliott, Alina Fritsch, Allegra Tinnefeld, ","1,679",,"https://m.media-amazon.com/images/M/MV5BMzc3YTcyNWQtODkxYS00NWIxLWE1MGMtZTViZmZjOGVhMmYyXkEyXkFqcGdeQXVyNTQ2NjI3NDQ@._V1_UX140_CR0,0,140,209_AL_.jpg",Movie,"['Sarah Drew', 'Brennan Elliott', 'Alina Fritsch', 'Allegra Tinnefeld']","['Drama', 'Family', 'Romance']",0.6455696202531647,0.41414141414141414
Magical Christmas Ornaments,TV-14,90.0,6.3,,"Drama, Fantasy, Romance",2017.0,"""After a bad breakup, former Christmas lover Marie (Lowndes) loses her Christmas spirit. Trying to restore it, her mother sends Marie Christmas ornaments from her childhood, and a ...                See full summary »",Don McBrearty,"Jessica Lowndes, Brendan Penny, Farah Merani, Stephen Huszar, ","1,898",,"https://m.media-amazon.com/images/M/MV5BMDFjYWRhNjUtNmZkMy00OTljLWI4NWQtZGQ4MTQwY2ExNGY3XkEyXkFqcGdeQXVyNTU2MDQyOTk@._V1_UX140_CR0,0,140,209_AL_.jpg",Movie,"['Jessica Lowndes', 'Brendan Penny', 'Farah Merani', 'Stephen Huszar']","['Drama', 'Fantasy', 'Romance']",0.6329113924050633,0.4494949494949495
Royally Wrapped for Christmas,,85.0,6.3,,Romance,2021.0,"The director of an international charity organization is called to the Kingdom of Valdonia by the royal family, where she grows closer to a prince.",T.W. Peacocke,"Jen Lilley, Brendan Fehr, Michael Hanrahan, Fiona Reid, ",835,,"https://m.media-amazon.com/images/M/MV5BZjFjZjRkZTUtNTFkOS00ZTc3LThjNTktMWJmOTYxMmQwZGRkXkEyXkFqcGdeQXVyMTU5MjU5MTM@._V1_UX140_CR0,0,140,209_AL_.jpg",Movie,"['Jen Lilley', 'Brendan Fehr', 'Michael Hanrahan', 'Fiona Reid']",['Romance'],0.6329113924050633,0.42424242424242425
The Christmas Chalet,,90.0,6.6,,"Drama, Family, Romance",2019.0,"A Christmas-loving divorcee books a chalet with her mother and daughter for the holidays, where she meets a writer who despises Christmas. Together they learn the magic of Christmas and family.",Jennifer Gibson,"Erica Durance, Robin Dunne, Elva Mai Hoover, Micah Kalisch, ",977,,"https://m.media-amazon.com/images/M/MV5BYzE2NWFmNzgtM2UyNS00YmFiLThhMjktZGY5ZGRkYzk4YzE1XkEyXkFqcGdeQXVyMTQyNDk2NzE@._V1_UY209_CR2,0,140,209_AL_.jpg",Movie,"['Erica Durance', 'Robin Dunne', 'Elva Mai Hoover', 'Micah Kalisch']","['Drama', 'Family', 'Romance']",0.6708860759493671,0.4494949494949495
Love at the Christmas Contest,,90.0,5.7,,"Comedy, Romance",2022.0,"A young woman enters a Christmas tree decorating contest to honor the memory of her mother, only to discover that the competition includes her recently-widowered high school sweetheart, and his adorable 10-year-old daughter.",John Burd,"Samantha Cope, Ross Jirgl, James Healy Jr., Triana Browne, ",473,,"https://m.media-amazon.com/images/M/MV5BOGYwYWFhMTEtMDY4Mi00NTU5LWEzNjEtZTc4NDM1YmU2NGU0XkEyXkFqcGdeQXVyMTE1MjU4NjU5._V1_UY209_CR1,0,140,209_AL_.jpg",Movie,"['Samantha Cope', 'Ross Jirgl', 'James Healy Jr.', 'Triana Browne']","['Comedy', 'Romance']",0.5569620253164558,0.4494949494949495
Two Turtle Doves,TV-G,84.0,6.8,,"Drama, Family, Romance",2019.0,"Dr. Sharon Hayes (DeLoach) searches for a beloved family heirloom in a small Christmas town. When she unexpectedly discovers an adorable little girl and her disheartened father (Rady), she realizes that Christmas miracles really do happen.",Lesley Demetriades,"Nikki Deloach, Michael Rady, Michaela Russell, Zach Tinker, ","1,434",,"https://m.media-amazon.com/images/M/MV5BNGYyNGIzMTQtNjU0Mi00NGE5LTgxM2EtYWM2OTQwMzU5ODBkXkEyXkFqcGdeQXVyNTQ2NjI3NDQ@._V1_UX140_CR0,0,140,209_AL_.jpg",Movie,"['Nikki Deloach', 'Michael Rady', 'Michaela Russell', 'Zach Tinker']","['Drama', 'Family', 'Romance']",0.6962025316455697,0.41919191919191917
Four Christmases and a Wedding,TV-14,90.0,5.9,,"Comedy, Drama, Family",2017.0,"Chloe plans the first Christmas Fair where she meets Evan and falls in love, but he goes to Norway for his dream job. He brings someone else to the second one; during the third one, Chloe is dating Ted. What will happen this year?",Marita Grabiak,"Arielle Kebbel, Corey Sevier, Markie Post, Madison Smith, ","1,409",,"https://m.media-amazon.com/images/M/MV5BYjBkY2Y1MjYtNjQ4YS00NTJlLTlmNDUtNmE1ODc5ZDNmYzg2XkEyXkFqcGdeQXVyMjczOTU2NTI@._V1_UX140_CR0,0,140,209_AL_.jpg",Movie,"['Arielle Kebbel', 'Corey Sevier', 'Markie Post', 'Madison Smith']","['Comedy', 'Drama', 'Family']",0.5822784810126583,0.4494949494949495
Reindeer Games Homecoming,TV-PG,90.0,6.9,,"Comedy, Drama, Romance",2022.0,"After her father dies, MacKenzie keeps his tradition of the town's fundraising ""The Reindeer Games"" alive, but when high-school crush Chase shows up and plays against her, the spark between them grows.",Brian Herzlinger,"Sarah Drew, Justin Bruening, Brian Sills, Dorian Giordano, ",603,,"https://m.media-amazon.com/images/M/MV5BN2VmNjI2NGItZTExMi00MDMxLWJkNjgtYzNhYWVlM2FjMWFkXkEyXkFqcGdeQXVyMjIzOTA2NDk@._V1_UX140_CR0,0,140,209_AL_.jpg",Movie,"['Sarah Drew', 'Justin Bruening', 'Brian Sills', 'Dorian Giordano']","['Comedy', 'Drama', 'Romance']",0.708860759493671,0.4494949494949495
Mistletoe & Menorahs,TV-PG,85.0,6.4,,"Comedy, Drama, Romance",2019.0,"When a toy-company executive must learn about Hanukkah to land a big account, she enlists the help of her co-worker's friend, who happens to be in need of turning his pad into a Christmas Wonderland to impress his girlfriend's father.",Max McGuire,"Kelley Jakle, Jake Epstein, Cory Lee, Jon McLaren, ",992,,"https://m.media-amazon.com/images/M/MV5BY2QwNzgwMjgtM2Y3MS00YzVjLTgxYzgtNjQ4ODEzN2I3MTFmXkEyXkFqcGdeQXVyODY0NzcxNw@@._V1_UY209_CR8,0,140,209_AL_.jpg",Movie,"['Kelley Jakle', 'Jake Epstein', 'Cory Lee', 'Jon McLaren']","['Comedy', 'Drama', 'Romance']",0.6455696202531647,0.42424242424242425
Inn Love by Christmas,,88.0,5.9,,"Comedy, Drama, Romance",2020.0,"On her way home to spend Christmas with her grandmother, Mandy runs into Lucas, her old high school rival.",Jesse D. Ikeman,"Jonna Walsh, Jesse Hutch, Jayne Eastwood, Tammy Isbell, ",778,,"https://m.media-amazon.com/images/M/MV5BMmUzMWUyOTctMzRlNi00YzEwLWJjM2EtOWJkMjllZmM5NDJkXkEyXkFqcGdeQXVyMTQ2NjExOA@@._V1_UX140_CR0,0,140,209_AL_.jpg",Movie,"['Jonna Walsh', 'Jesse Hutch', 'Jayne Eastwood', 'Tammy Isbell']","['Comedy', 'Drama', 'Romance']",0.5822784810126583,0.4393939393939394
Picture a Perfect Christmas,TV-G,84.0,6.9,,"Comedy, Drama, Romance",2019.0,A professional photographer returns home for Christmas to visit her grandmother and is hired as a nanny for the young nephew of their next-door-neighbor.,Paul Ziller,"Merritt Patterson, Jon Cor, Luke Roessler, Paula Shaw, ","1,872",,"https://m.media-amazon.com/images/M/MV5BMjllMGNlOTYtN2Y4NC00N2M0LTgxYTItMjA0MWQ0ZGJiYTEzXkEyXkFqcGdeQXVyODY0NzcxNw@@._V1_UX140_CR0,0,140,209_AL_.jpg",Movie,"['Merritt Patterson', 'Jon Cor', 'Luke Roessler', 'Paula Shaw']","['Comedy', 'Drama', 'Romance']",0.708860759493671,0.41919191919191917
3 Godfathers,Passed,106.0,7.0,82.0,"Drama, Western",1948.0,Three outlaws on the run risk their freedom and their lives to return a newborn to civilization.,John Ford,"John Wayne, Pedro Armendáriz, Harry Carey Jr., Ward Bond, ","10,308",,"https://m.media-amazon.com/images/M/MV5BNjNmMzE5MzEtZmM3YS00ODljLWI1YTEtMWU1MmMyZGNiODg1XkEyXkFqcGdeQXVyMTY5Nzc4MDY@._V1_UX140_CR0,0,140,209_AL_.jpg",Movie,"['John Wayne', 'Pedro Armendáriz', 'Harry Carey Jr.', 'Ward Bond']","['Drama', 'Western']",0.7215189873417722,0.5303030303030303
The Christmas Doctor,TV-G,84.0,6.9,,"Drama, Romance",2020.0,A travelling doctor finds love and a home at her latest assignment in Willowbrook.,Kevin Fair,"Holly Robinson Peete, Adrian Holmes, Fred Henderson, Bronwen Smith, ",912,,"https://m.media-amazon.com/images/M/MV5BNTdhOWI0OWEtZjJkYS00NTA2LWI5MTMtYTQzMTFmZmM4ZTgxXkEyXkFqcGdeQXVyNjY4Mzc0NA@@._V1_UX140_CR0,0,140,209_AL_.jpg",Movie,"['Holly Robinson Peete', 'Adrian Holmes', 'Fred Henderson', 'Bronwen Smith']","['Drama', 'Romance']",0.708860759493671,0.41919191919191917
A Boyfriend for Christmas,TV-G,94.0,6.4,,"Comedy, Drama, Family",2004.0,"On Christmas Day, Santa brings two lonely people together. But can love overcome deception?",Kevin Connor,"Kelli Williams, Patrick Muldoon, Charles Durning, Bruce Thomas, ","3,404",,"https://m.media-amazon.com/images/M/MV5BMTcyNjY4NDg0NV5BMl5BanBnXkFtZTcwNTA1NjMzMQ@@._V1_UY209_CR3,0,140,209_AL_.jpg",Movie,"['Kelli Williams', 'Patrick Muldoon', 'Charles Durning', 'Bruce Thomas']","['Comedy', 'Drama', 'Family']",0.6455696202531647,0.4696969696969697
A Holiday for Love,,105.0,6.4,,"Drama, Family, Romance",1996.0,"A man is sent to a small town to assess which of the workers in the local factory that supplies the town with jobs should get the boot when the downsizing begins. He gets sidetracked when he falls in love with a local, a cute single mom.",Jerry London,"Tim Matheson, Melissa Gilbert, Michelle Trachtenberg, Jayne Eastwood, ",746,,"https://m.media-amazon.com/images/M/MV5BNzExNDNiN2YtZTYzMS00MDgzLTlhNWUtNTUxYzM5MzgyN2JiXkEyXkFqcGdeQXVyMjQ0MDU4NjE@._V1_UY209_CR8,0,140,209_AL_.jpg",Movie,"['Tim Matheson', 'Melissa Gilbert', 'Michelle Trachtenberg', 'Jayne Eastwood']","['Drama', 'Family', 'Romance']",0.6455696202531647,0.5252525252525253
