title,rating,runtime,imdb_rating,meta_score,genre,release_year,description,director,stars,votes,gross,img_src,type,stars_list,genre_list,rating_norm,runtime_norm
Once Upon a Time at Christmas,R,97.0,3.5,,Horror,2017.0,"When a serial-killer couple dressed as Santa and Mrs. Claus terrorizes a small town, a teen girl and a young cop must solve the pattern behind the seemingly random homicides.",Paul Tanter,"Simon Phillips, Sayla de Goede, Yana Gold, Paul Thomas Arnold, ",658,,"https://m.media-amazon.com/images/M/MV5BNzllNzVjNTItZDhhOC00ZDEzLTg5MTUtMDg2MTgwMzY4ZGViXkEyXkFqcGdeQXVyMTU2ODM0NTU@._V1_UY209_CR15,0,140,209_AL_.jpg",Movie,"['Simon Phillips', 'Sayla de Goede', 'Yana Gold', 'Paul Thomas Arnold']",['Horror'],0.2784810126582279,0.48484848484848486
Christmas on the Vine,TV-PG,87.0,6.1,,"Drama, Romance",2020.0,A young marketing executive is assigned to help a struggling family-owned winery in a town that has lost its Christmas spirit due to a large wine conglomerate.,Paul A. Kaufman,"Julianna Guill, Jon Cor, Meredith Baxter, Chilton Crane, ",629,,"https://m.media-amazon.com/images/M/MV5BMDM4NzNjOGQtYTNiOC00YjU4LWJmZWUtYTQxOGRmMjQwM2E5XkEyXkFqcGdeQXVyNTQ2NjI3NDQ@._V1_UX140_CR0,0,140,209_AL_.jpg",Movie,"['Julianna Guill', 'Jon Cor', 'Meredith Baxter', 'Chilton Crane']","['Drama', 'Romance']",0.6075949367088608,0.43434343434343436
Christmas Eve,,93.0,7.3,,Drama,1986.0,A well-to-do elderly woman who befriends the homeless and volunteers her time with children learns that she has an incurable illness. She desperately wants to reunited her three grown ...                See full summary »,Stuart Cooper,"Loretta Young, Arthur Hill, Ron Leibman, Trevor Howard, ",442,,"https://m.media-amazon.com/images/M/MV5BODcwYThjMmEtNzk0MC00NGRlLWJlOWEtMjZlMmU2ZGMxODY5XkEyXkFqcGdeQXVyMTI2OTM0NzQ@._V1_UX140_CR0,0,140,209_AL_.jpg",Movie,"['Loretta Young', 'Arthur Hill', 'Ron Leibman', 'Trevor Howard']",['Drama'],0.759493670886076,0.46464646464646464
Magic Stocking,,86.0,6.4,,"Comedy, Drama, Fantasy",2015.0,"A young widow's daughter is given a tattered old Christmas stocking at a holiday craft sale, but her mother is skeptical of its magic when it seems to create small trinkets on its own.",David Winning,"Bridget Regan, Victor Webster, Iris Quinn, Imogen Tear, ","1,693",,"https://m.media-amazon.com/images/M/MV5BZmI3Y2Q5ZTctZDNjMC00MTZjLTg4YmEtZmM0YzUzN2M5ZjA5XkEyXkFqcGdeQXVyMzUxMzEwODA@._V1_UX140_CR0,0,140,209_AL_.jpg",Movie,"['Bridget Regan', 'Victor Webster', 'Iris Quinn', 'Imogen Tear']","['Comedy', 'Drama', 'Fantasy']",0.6455696202531647,0.4292929292929293
Christmas Time,TV-PG,90.0,5.9,,Comedy,2017.0,Two estranged brothers try to reconnect at Christmas but there's something that one of them can't get past...the other think's he's a time traveler.,Jake Van Wagoner,"Maclain Nelson, Jake Van Wagoner, Clare Niederpruem, Adam Johnson, ",491,,"https://m.media-amazon.com/images/M/MV5BMjRjMGRhNGUtYjI3My00YTU0LTk4ZTUtMWFkYWNkNTU3NjgzXkEyXkFqcGdeQXVyMjI2MDU2NTk@._V1_UY209_CR0,0,140,209_AL_.jpg",Movie,"['Maclain Nelson', 'Jake Van Wagoner', 'Clare Niederpruem', 'Adam Johnson']",['Comedy'],0.5822784810126583,0.4494949494949495
Paper Angels,Not Rated,90.0,6.6,,Drama,2014.0,"An abused wife leaves her alcoholic husband and moves with her children to another town, where their lives become entwined with that of another family in trouble.",David Winning,"Matthew Settle, Rustin Gresiuk, Josie Bissett, Farryn VanHumbeck, ",720,,"https://m.media-amazon.com/images/M/MV5BMTQ5MTc2NDc2M15BMl5BanBnXkFtZTgwODQ3NzQ5MjE@._V1_UY209_CR9,0,140,209_AL_.jpg",Movie,"['Matthew Settle', 'Rustin Gresiuk', 'Josie Bissett', 'Farryn VanHumbeck']",['Drama'],0.6708860759493671,0.4494949494949495
"Christmas, Again",Not Rated,80.0,6.6,79.0,"Drama, Romance",2014.0,"A heartbroken Christmas-tree salesman returns to New York City hoping to put his past behind him. Living in a trailer and working the night shift, he begins to spiral downwards until the ...                See full summary »",Charles Poekel,"Kentucker Audley, Jason Shelton, Oona Roche, David Gauld, ","1,190",,"https://m.media-amazon.com/images/M/MV5BNjU4MWNjOTMtOTQ0NS00MWVhLWI4MmYtNzFhOWIwMDI4NjBjL2ltYWdlL2ltYWdlXkEyXkFqcGdeQXVyNjg5MzE4NTA@._V1_UY209_CR0,0,140,209_AL_.jpg",Movie,"['Kentucker Audley', 'Jason Shelton', 'Oona Roche', 'David Gauld']","['Drama', 'Romance']",0.6708860759493671,0.398989898989899
A New Orleans Noel,TV-PG,85.0,5.8,,"Comedy, Drama, Romance",2022.0,"Follows Grace and Anthony, who despite having gone to college to study architecture together, are too different, but things between them change after both are hired to work on the same place and end up celebrating Christmas together.",Angela Tucker,"Keshia Knight Pulliam, Tim Reid, Brad James, Patti LaBelle, ",278,,"https://m.media-amazon.com/images/M/MV5BYjk2MjBiZDgtNjc0Yi00MjlhLWEyNmQtMTU0MTVhZDAwZGE4XkEyXkFqcGdeQXVyNjU4ODQ2MTQ@._V1_UX140_CR0,0,140,209_AL_.jpg",Movie,"['Keshia Knight Pulliam', 'Tim Reid', 'Brad James', 'Patti LaBelle']","['Comedy', 'Drama', 'Romance']",0.569620253164557,0.42424242424242425
Engaging Father Christmas,TV-G,85.0,6.7,,"Drama, Romance",2017.0,"This Christmas promises to be the best of Miranda Chester's life. She has returned to the beautiful New England town of Carlton Heath, where last year she found love with Ian McAndrick and she is among the family she never knew she had.",David Winning,"Erin Krakow, Niall Matter, Wendie Malick, P. Lynn Johnson, ","1,802",,"https://m.media-amazon.com/images/M/MV5BZjczMzM3ZDUtNDgyOS00NDk4LWIzN2ItZTI0ZWZjNmRhNmRiXkEyXkFqcGdeQXVyNTU2MDQyOTk@._V1_UX140_CR0,0,140,209_AL_.jpg",Movie,"['Erin Krakow', 'Niall Matter', 'Wendie Malick', 'P. Lynn Johnson']","['Drama', 'Romance']",0.6835443037974684,0.42424242424242425
Pete's Christmas,PG,86.0,6.0,,"Comedy, Drama, Family",2013.0,A put-upon teen finds himself reliving the same miserable Christmas day over and over again.,Nisha Ganatra,"Zachary Gordon, Molly Parker, Rick Roberts, Wesley Morgan, ","2,021",,"https://m.media-amazon.com/images/M/MV5BNGQ1ODkxMGUtMjIwMC00NTVmLWE1YTEtNjAxYmQyZDYzMDJjL2ltYWdlL2ltYWdlXkEyXkFqcGdeQXVyNjg5MzE4NTA@._V1_UX140_CR0,0,140,209_AL_.jpg",Movie,"['Zachary Gordon', 'Molly Parker', 'Rick Roberts', 'Wesley Morgan']","['Comedy', 'Drama', 'Family']",0.5949367088607596,0.4292929292929293
A Puppy for Christmas,TV-PG,85.0,5.9,,"Comedy, Drama, Romance",2016.0,"After adopting a cute puppy, Noelle's world is turned upside down when her boyfriend breaks up with her. After accepting an invitation to spend the holidays with a co-worker, she is ...                See full summary »",Justin G. Dyck,"Cindy Busby, Greyston Holt, Christopher Russell, Allison Price, ","1,158",,"https://m.media-amazon.com/images/M/MV5BMDRjYmY3MDAtZTlmOS00ODAxLTlmMWQtZDJlNjBlOTU2M2E5XkEyXkFqcGdeQXVyNTM3MDMyMDQ@._V1_UY209_CR8,0,140,209_AL_.jpg",Movie,"['Cindy Busby', 'Greyston Holt', 'Christopher Russell', 'Allison Price']","['Comedy', 'Drama', 'Romance']",0.5822784810126583,0.42424242424242425
A Christmas Romance,TV-PG,94.0,6.1,,"Comedy, Drama, Family",1994.0,A widowed mother with financial woes comes to the aid of a bill collector who crashes his car in a snowstorm.,Sheldon Larry,"Olivia Newton-John, Gregory Harrison, Chloe Lattanzi, Stephanie Sawyer, ",876,,"https://m.media-amazon.com/images/M/MV5BZmFjMDYzYWQtZWRhNy00ODc2LTk2MTMtZTk4YWZkMTZjNTEyXkEyXkFqcGdeQXVyMTYyNjE1NDc4._V1_UX140_CR0,0,140,209_AL_.jpg",Movie,"['Olivia Newton-John', 'Gregory Harrison', 'Chloe Lattanzi', 'Stephanie Sawyer']","['Comedy', 'Drama', 'Family']",0.6075949367088608,0.4696969696969697
Christmas Pen Pals,TV-PG,87.0,7.0,,"Comedy, Drama, Romance",2018.0,"After being dumped by her boyfriend, a successful tech wiz dating-app creator returns to her hometown for the holiday season, and her dad gets her to sign up for the annual Christmas Cupid anonymous matchmaking event.",Siobhan Devine,"Sarah Drew, Niall Matter, Michael Gross, Chiara Zanni, ","1,553",,"https://m.media-amazon.com/images/M/MV5BMmNlYjQxNTEtNjliMy00MzdkLTk2NWMtYzU2ZTllMTFhN2FkXkEyXkFqcGdeQXVyNTM3MDMyMDQ@._V1_UY209_CR8,0,140,209_AL_.jpg",Movie,"['Sarah Drew', 'Niall Matter', 'Michael Gross', 'Chiara Zanni']","['Comedy', 'Drama', 'Romance']",0.7215189873417722,0.43434343434343436
"It's Christmastime Again, Charlie Brown",TV-G,23.0,6.9,,"Animation, Short, Comedy",1992.0,The Peanuts gang prepares for the holidays in their own unique ways.,Bill Melendez,"Jamie E. Smith, John Christian Graas, Marnette Patterson, Mindy Ann Martin, ","2,952",,"https://m.media-amazon.com/images/M/MV5BNWNmNzU3MGQtMmU3My00NWJmLWFjNDUtNzJkY2ZkOTE3MTZlXkEyXkFqcGdeQXVyODI3NjA3Nzc@._V1_UY209_CR0,0,140,209_AL_.jpg",Movie,"['Jamie E. Smith', 'John Christian Graas', 'Marnette Patterson', 'Mindy Ann Martin']","['Animation', 'Short', 'Comedy']",0.708860759493671,0.1111111111111111
An Ice Wine Christmas,TV-PG,84.0,5.1,,"Comedy, Drama, Romance",2021.0,"One of Philadelphia's top wine sommeliers goes home to the magical vineyards of Evergreen, New York to take part in the town's annual Ice Wine Christmas Festival and Harvest.",Jill Carter,"Roselyn Sanchez, Megha Sandhu, Nck Name, Juan Chioran, ",353,,"https://m.media-amazon.com/images/M/MV5BYjQzYTMxNGYtZjE0NS00NDA2LTg5ZDAtMGE2OGY4OTYyODFkXkEyXkFqcGdeQXVyMTExNDQ2MTI@._V1_UX140_CR0,0,140,209_AL_.jpg",Movie,"['Roselyn Sanchez', 'Megha Sandhu', 'Nck Name', 'Juan Chioran']","['Comedy', 'Drama', 'Romance']",0.4810126582278481,0.41919191919191917
Meet Me at Christmas,,82.0,6.4,,"Drama, Romance",2020.0,"When Joan's (Bell) son's wedding planner unexpectedly quits, she must coordinate his Christmas Eve wedding with the help of the bride's uncle Beau (Deklin). As they work alongside each ...                See full summary »",Annie Bradley,"Catherine Bell, Mark Deklin, Luke Bilyk, Sage Kitchen, ","1,139",,"https://m.media-amazon.com/images/M/MV5BODliNGQ3MTctZTljZi00M2ZhLTg4NjMtZjIzOWM2OGI5MjEzXkEyXkFqcGdeQXVyNTQ2NjI3NDQ@._V1_UX140_CR0,0,140,209_AL_.jpg",Movie,"['Catherine Bell', 'Mark Deklin', 'Luke Bilyk', 'Sage Kitchen']","['Drama', 'Romance']",0.6455696202531647,0.4090909090909091
Kristin's Christmas Past,TV-PG,86.0,6.2,,"Adventure, Comedy, Family",2013.0,"Given the opportunity to visit her estranged family on Christmas Eve 1996, Kristin Cartwright hopes to change her past in order to improve her current life in 2013.",Jim Fall,"Shiri Appleby, Will Kemp, Courtney Henggeler, Esperanza América, ","1,266",,"https://m.media-amazon.com/images/M/MV5BNjMyMDQyNTczOV5BMl5BanBnXkFtZTgwNzg4ODE3MDE@._V1_UY209_CR8,0,140,209_AL_.jpg",Movie,"['Shiri Appleby', 'Will Kemp', 'Courtney Henggeler', 'Esperanza América']","['Adventure', 'Comedy', 'Family']",0.6202531645569621,0.4292929292929293
Journey to the Christmas Star,G,80.0,5.7,,"Adventure, Family, Fantasy",2012.0,Once upon a time a little girl went out to find the Christmas star.,Nils Gaup,"Vilde Zeiner, Anders Baasmo, Agnes Kittelsen, Stig-Werner Moe, ","1,697",,"https://m.media-amazon.com/images/M/MV5BMmI4Zjc4NzAtYjI2ZC00YmI1LWIxMDItNjJkNmM4NDVkMDc5XkEyXkFqcGdeQXVyODc0OTEyNDU@._V1_UY209_CR3,0,140,209_AL_.jpg",Movie,"['Vilde Zeiner', 'Anders Baasmo', 'Agnes Kittelsen', 'Stig-Werner Moe']","['Adventure', 'Family', 'Fantasy']",0.5569620253164558,0.398989898989899
The Trouble with Mistletoe,,111.0,6.2,,"Comedy, Drama, Romance",2017.0,"When San Francisco pet shop owner Willa Davis encounters the man who stood her up in high school, she fights both her head and her heart when she starts falling for him all over again ten years later.",Ashley Avis,"Rachel Melvin, Thomas Beaudoin, Alexandra Weaver, Annie Thurman, ",896,,"https://m.media-amazon.com/images/M/MV5BZGNjOTYwNTUtZmVhOS00MGRhLThhMDItYzRjYjA2NWIyYzUyXkEyXkFqcGdeQXVyMTA0NTk4Mw@@._V1_UX140_CR0,0,140,209_AL_.jpg",Movie,"['Rachel Melvin', 'Thomas Beaudoin', 'Alexandra Weaver', 'Annie Thurman']","['Comedy', 'Drama', 'Romance']",0.6202531645569621,0.5555555555555556
The Road Home for Christmas,TV-PG,84.0,6.8,,"Drama, Romance",2019.0,"Lindsey and Wes, rival musicians who perform in a dueling-piano show, suddenly find themselves without a gig on Christmas Eve and decide to road-trip to their neighboring hometowns together.",Peter Sullivan,"Marla Sokoloff, Jacob Young, Marie Osmond, Rob Mayes, ",768,,"https://m.media-amazon.com/images/M/MV5BMGZmMTliYTEtNWRkYy00ZWM0LThiYmUtOTc1N2M2ZTE5YTkzXkEyXkFqcGdeQXVyMTU0NjY0NDg@._V1_UY209_CR12,0,140,209_AL_.jpg",Movie,"['Marla Sokoloff', 'Jacob Young', 'Marie Osmond', 'Rob Mayes']","['Drama', 'Romance']",0.6962025316455697,0.41919191919191917
Santa & Cie,TV-PG,92.0,6.3,,"Comedy, Family, Fantasy",2017.0,"When all the elves get sick, Santa must find a cure on Earth to save Christmas.",Alain Chabat,"Alain Chabat, Golshifteh Farahani, Pio Marmaï, Bruno Sanches, ","2,923",,"https://m.media-amazon.com/images/M/MV5BYWE0OWRkZmItOGQxYi00YTQ1LTg3N2ItZjk2NzVhZjdhOGIyXkEyXkFqcGdeQXVyNzEyMDU1MzU@._V1_UY209_CR7,0,140,209_AL_.jpg",Movie,"['Alain Chabat', 'Golshifteh Farahani', 'Pio Marmaï', 'Bruno Sanches']","['Comedy', 'Family', 'Fantasy']",0.6329113924050633,0.4595959595959596
Christmas Connection,TV-G,83.0,6.4,,"Comedy, Drama, Family",2017.0,A flight attendant teams up with a newspaper columnist to investigate how her late-parents first met.,Steven R. Monroe,"Brooke Burns, Tom Everett Scott, Sophie Neudorf, Micheline Marchildon, ","2,010",,"https://m.media-amazon.com/images/M/MV5BMzAzYWVhOGMtOWI1MC00OWQzLTkzMTYtNWFlMThlMWNlMDFhXkEyXkFqcGdeQXVyODE1MDM1MTI@._V1_UX140_CR0,0,140,209_AL_.jpg",Movie,"['Brooke Burns', 'Tom Everett Scott', 'Sophie Neudorf', 'Micheline Marchildon']","['Comedy', 'Drama', 'Family']",0.6455696202531647,0.41414141414141414
Hometown Holiday,TV-PG,84.0,5.1,,"Comedy, Drama, Romance",2018.0,"Krista is starting this New Year with a new business and a resolution to be more selective with who she dates. When Krista meets Ryan Rourke, an entertainment lawyer from LA, the two really...                See full summary »",Justin G. Dyck,"Sarah Troyer, Bradley Hamilton, Kevin McGarry, Samantha Gracie, ","1,171",,"https://m.media-amazon.com/images/M/MV5BOGY0NmE2ZDAtOThlMC00MDQ1LWIyNTktMDQ5MDcxNGY1YjIwXkEyXkFqcGdeQXVyNjI4Mzg5OTg@._V1_UY209_CR2,0,140,209_AL_.jpg",Movie,"['Sarah Troyer', 'Bradley Hamilton', 'Kevin McGarry', 'Samantha Gracie']","['Comedy', 'Drama', 'Romance']",0.4810126582278481,0.41919191919191917
Pups Alone,PG,107.0,3.3,,"Comedy, Family",2021.0,"While everyone is away on a company ski trip, Robert's neighbor hires two inept thieves to steal his latest invention. The neighborhood dogs will use Robert's inventions to set up a house of horrors for the thieves.",Alex Merkin,"Jerry O'Connell, Jennifer Love Hewitt, Rob Schneider, Danny Trejo, ","1,437",,"https://m.media-amazon.com/images/M/MV5BZjdkY2Y2NTctMGNhNS00ZTM4LTg4YTItYmQ5ZGRlNjhiNzZmXkEyXkFqcGdeQXVyOTg4MDYyNw@@._V1_UX140_CR0,0,140,209_AL_.jpg",Movie,"[""Jerry O'Connell"", 'Jennifer Love Hewitt', 'Rob Schneider', 'Danny Trejo']","['Comedy', 'Family']",0.2531645569620253,0.5353535353535354
Eve's Christmas,TV-PG,96.0,5.9,,"Comedy, Family, Fantasy",2004.0,A wealthy and successful career woman gets a second chance in life when a magical wish transports her back in time eight years to when she walked away from her fiance to lead a business life in New York.,Timothy Bond,"Elisa Donovan, Sebastian Spence, Cheryl Ladd, Winston Rekert, ","1,204",,"https://m.media-amazon.com/images/M/MV5BMTcxMDQzNzEyNV5BMl5BanBnXkFtZTcwMDMzMTIzMQ@@._V1_UY209_CR4,0,140,209_AL_.jpg",Movie,"['Elisa Donovan', 'Sebastian Spence', 'Cheryl Ladd', 'Winston Rekert']","['Comedy', 'Family', 'Fantasy']",0.5822784810126583,0.4797979797979798
A Christmas to Cherish,TV-G,83.0,6.1,,"Comedy, Drama, Family",2019.0,"As Darcy and Aiden prepare to celebrate their second Christmas together, an unexpected guest and a fight to save the beloved community center unites everyone for an unforgettable holiday.",Kevin Fair,"Peter Porte, Ali Liebert, Tina Lifford, Dominic Mariche, ","1,039",,"https://m.media-amazon.com/images/M/MV5BZjc2ODQwYjgtOGE2NC00MWVhLTgyNzctODk5MThjYmNiZjU4XkEyXkFqcGdeQXVyMTgxMDY4NzY@._V1_UX140_CR0,0,140,209_AL_.jpg",Movie,"['Peter Porte', 'Ali Liebert', 'Tina Lifford', 'Dominic Mariche']","['Comedy', 'Drama', 'Family']",0.6075949367088608,0.41414141414141414
Ice Sculpture Christmas,TV-G,83.0,6.5,,"Comedy, Drama, Romance",2015.0,"Callie, an aspiring chef, with her childhood friend David, enters Callie into a club's annual Christmas ice sculpting competition against her boss. Callie's passions for cooking and ice sculpting are met with romance and Christmas spirit.",David Mackay,"Rachel Boston, David Alpay, Brenda Strong, Paul McGillion, ","2,342",,"https://m.media-amazon.com/images/M/MV5BMjE1NjI1OTc3NV5BMl5BanBnXkFtZTgwNDM4MDEzNzE@._V1_UX140_CR0,0,140,209_AL_.jpg",Movie,"['Rachel Boston', 'David Alpay', 'Brenda Strong', 'Paul McGillion']","['Comedy', 'Drama', 'Romance']",0.6582278481012659,0.41414141414141414
Beat Street,PG,105.0,6.5,68.0,"Drama, Music",1984.0,"An aspiring DJ from the South Bronx and his best friend, a promoter, try to get into show business by exposing people to hip-hop music and the local culture.",Stan Lathan,"Rae Dawn Chong, Guy Davis, Jon Chardiet, Leon W. Grant, ","4,237",$16.60M,"https://m.media-amazon.com/images/M/MV5BMTM4NTg2NDA3N15BMl5BanBnXkFtZTcwODM0NjgyNA@@._V1_UX140_CR0,0,140,209_AL_.jpg",Movie,"['Rae Dawn Chong', 'Guy Davis', 'Jon Chardiet', 'Leon W. Grant']","['Drama', 'Music']",0.6582278481012659,0.5252525252525253
Santa's Boots,TV-PG,85.0,6.2,,"Comedy, Drama, Romance",2018.0,"Forced to take a vacation from her job in Seattle, Holly returns to her hometown where she reluctantly agrees to become Santa's new elf at her dad's local department store.",Shawn Tolleson,"Megan Hilty, Noah Mills, Roark Critchlow, Patricia Isaac, ",722,,"https://m.media-amazon.com/images/M/MV5BNTdmNmNmZjktMGVjYy00MzM4LWIyZGQtNjNhZGJkY2U3ZjZlXkEyXkFqcGdeQXVyNTQ2NjI3NDQ@._V1_UX140_CR0,0,140,209_AL_.jpg",Movie,"['Megan Hilty', 'Noah Mills', 'Roark Critchlow', 'Patricia Isaac']","['Comedy', 'Drama', 'Romance']",0.6202531645569621,0.42424242424242425
Christmas Collision,,95.0,3.5,,"Drama, Romance",2021.0,"Theodora, a time consumed professional crosses paths with Charlie, a writer, when she travels to his hometown for business just before Christmas. Both are taken by surprise when unexpected circumstances present themselves.",Lana Read,"Sebrina Scott, Alyssa Ryan, Vernon Wells, Eric Six, ",222,,"https://m.media-amazon.com/images/M/MV5BMmEwZjg3ODYtMDQ5NS00OGY3LWE4ODktYzViMjVmYjMyZDcwXkEyXkFqcGdeQXVyNjEzNDE2MTA@._V1_UY209_CR0,0,140,209_AL_.jpg",Movie,"['Sebrina Scott', 'Alyssa Ryan', 'Vernon Wells', 'Eric Six']","['Drama', 'Romance']",0.2784810126582279,0.47474747474747475
When Christmas Was Young,PG,87.0,6.1,,"Comedy, Romance",2022.0,A successful music manager returns home to secure the rights to a Christmas love song written by his high school girlfriend.,Monika Mitchell,"Karen David, Tyler Hilton, Jayce Barreiro, Meghan Heffern, ",388,,"https://m.media-amazon.com/images/M/MV5BODQzYzVjZWQtYTEyMi00MzE3LWFmNmUtNGY5M2IwYjgxMDg0XkEyXkFqcGdeQXVyNjU0NTI0Nw@@._V1_UX140_CR0,0,140,209_AL_.jpg",Movie,"['Karen David', 'Tyler Hilton', 'Jayce Barreiro', 'Meghan Heffern']","['Comedy', 'Romance']",0.6075949367088608,0.43434343434343436
Christmas Cupcakes,,88.0,5.7,,"Comedy, Drama",2018.0,"With their family bakery facing foreclosure, two sisters must team-up to try and save it by entering a TV baking competition.",Dylan Pearce,"Cindy Busby, Erin Karpluk, Corey Loranger, Fulvio Cecere, ",720,,"https://m.media-amazon.com/images/M/MV5BOGRiOGExMzItYTE3OS00ZmI1LTk4YmItMmY4ZmU0NzE1YzIxXkEyXkFqcGdeQXVyNjMyOTAyMzk@._V1_UX140_CR0,0,140,209_AL_.jpg",Movie,"['Cindy Busby', 'Erin Karpluk', 'Corey Loranger', 'Fulvio Cecere']","['Comedy', 'Drama']",0.5569620253164558,0.4393939393939394
A Flintstone Christmas,Not Rated,60.0,6.8,,"Animation, Family",1977.0,"When Santa has an accident at Fred's house on Christmas Eve, Fred and Barney have to continue his run for him.",Sid Marcus,"Charles Nichols, Alex Lovy, Gerry Chiniquy, Hawley Pratt, Mel Blanc, Lucille Bliss, Henry Corden, Virginia Gregg, ",951,,"https://m.media-amazon.com/images/M/MV5BN2ZhYmNjMmQtZTQ0Yi00MDY2LThjN2YtOGMxNDAzZjFlN2E4XkEyXkFqcGdeQXVyNTM3MDMyMDQ@._V1_UY209_CR8,0,140,209_AL_.jpg",Movie,"['Charles Nichols', 'Alex Lovy', 'Gerry Chiniquy', 'Hawley Pratt', 'Mel Blanc', 'Lucille Bliss', 'Henry Corden', 'Virginia Gregg']","['Animation', 'Family']",0.6962025316455697,0.29797979797979796
Christmas in Harmony,TV-G,84.0,5.5,,"Drama, Romance",2021.0,"Harmony is tricked into auditioning for the Holiday Chorus- directed by an ex-boyfriend. By Christmas Eve, they could be harmonizing in the key of love.",Rusty Cundieff,"Ashleigh Murray, Luke James, Basil Wallace, Michelle Williams, ",738,,"https://m.media-amazon.com/images/M/MV5BZGFjZWM3MTQtNDljMC00NDY3LTkyMzYtYTM2YjU4NTI3Yzc3XkEyXkFqcGdeQXVyMjIzOTA2NDk@._V1_UX140_CR0,0,140,209_AL_.jpg",Movie,"['Ashleigh Murray', 'Luke James', 'Basil Wallace', 'Michelle Williams']","['Drama', 'Romance']",0.5316455696202532,0.41919191919191917
Swept Up by Christmas,TV-G,84.0,6.2,,"Comedy, Drama, Romance",2019.0,"An antique seller and a cleaner clash over how to downsize a magnificent estate right before Christmas. As the two uncover the house's treasures, they find a way to reconnect the reclusive owner with his own Christmases past.",Philippe Gagnon,"Lindy Booth, Justin Bruening, Vlasta Vrana, Susan Bain, ",971,,"https://m.media-amazon.com/images/M/MV5BY2E1MTY3NmEtNThkNC00M2FlLWJiZTEtMTU4MGZlZTRjMTQxXkEyXkFqcGdeQXVyNjU0NTI0Nw@@._V1_UX140_CR0,0,140,209_AL_.jpg",Movie,"['Lindy Booth', 'Justin Bruening', 'Vlasta Vrana', 'Susan Bain']","['Comedy', 'Drama', 'Romance']",0.6202531645569621,0.41919191919191917
Meet the Andersons,Unrated,90.0,4.1,,"Comedy, Family",2016.0,Mike and Caroline Anderson have always gone all out with parties and gifts for Christmas with their 10-year-old twins Brendan and Julia. But when Michael loses his job just before the ...                See full summary »,Michael Feifer,"George Stults, Christy Carlson Romano, Savannah Judy, Luke Judy, ",540,,"https://m.media-amazon.com/images/M/MV5BZjY1Nzg3MjAtNzRlYS00MWNhLWEwOWYtMDlkOTQwOWE4YjdjXkEyXkFqcGdeQXVyNjQ2NjYzNDk@._V1_UY209_CR0,0,140,209_AL_.jpg",Movie,"['George Stults', 'Christy Carlson Romano', 'Savannah Judy', 'Luke Judy']","['Comedy', 'Family']",0.35443037974683544,0.4494949494949495
Christmas on the Rocks,,90.0,5.7,,Romance,2022.0,"When an event planner is hurt, her twin sister pretends to be her to save an important corporate client, but things go awry when an old flame reappears and the twin is still stuck pretending to be her sister.",Lane Shefter Bishop,"Khiyla Aynne, Bukola Ayoka, Matthew Bennett, Billy MacLellan, ",125,,"https://m.media-amazon.com/images/M/MV5BNTNjNGI0YWMtYjc1OS00YjUyLWI0ZjctNjI3N2MzNGZiNTE2XkEyXkFqcGdeQXVyMTI5NTI0MDQw._V1_UY209_CR8,0,140,209_AL_.jpg",Movie,"['Khiyla Aynne', 'Bukola Ayoka', 'Matthew Bennett', 'Billy MacLellan']",['Romance'],0.5569620253164558,0.4494949494949495
Jingle Belle,TV-PG,86.0,5.9,,"Drama, Music, Romance",2018.0,A successful jingle writer is cajoled into returning to her hometown to write a song for the 50th anniversary of the annual Christmas Eve concert.,Peter Sullivan,"Tatyana Ali, Cornelius Smith Jr., Loretta Devine, Keshia Knight Pulliam, ",593,,"https://m.media-amazon.com/images/M/MV5BOGQ2MjZkNjYtNWIxYy00Y2VhLWEyZTEtOWY2MzgxZTNjMzNiXkEyXkFqcGdeQXVyMTU0NjY0NDg@._V1_UY209_CR10,0,140,209_AL_.jpg",Movie,"['Tatyana Ali', 'Cornelius Smith Jr.', 'Loretta Devine', 'Keshia Knight Pulliam']","['Drama', 'Music', 'Romance']",0.5822784810126583,0.4292929292929293
A Christmas in Royal Fashion,TV-PG,90.0,5.4,,Romance,2018.0,Handsome prince and fashion assistant fall in love amidst a Christmas fashion show.,Fred Olen Ray,"Cindy Busby, Diarmaid Murtagh, Adam Levy, Michael Paré, ",808,,"https://m.media-amazon.com/images/M/MV5BMWE4OGZmZmUtNjEwYi00MDU3LWFlZGQtMGQyMTE2M2NmOWMwXkEyXkFqcGdeQXVyMTU0NjY0NDg@._V1_UX140_CR0,0,140,209_AL_.jpg",Movie,"['Cindy Busby', 'Diarmaid Murtagh', 'Adam Levy', 'Michael Paré']",['Romance'],0.518987341772152,0.4494949494949495
The Santa Stakeout,TV-G,84.0,6.4,,"Comedy, Crime, Drama",2021.0,"Police detective Tanya is partnered with fellow detective Ryan to solve a recent string of heists. They go undercover as newlyweds, moving into the vacant house next to Mr. Miller, the prime suspect in the case.",Peter Benson,"Tamera Mowry-Housley, Paul Campbell, Joe Pantoliano, Peter Bryant, ","1,218",,"https://m.media-amazon.com/images/M/MV5BYWUwMDI4NzgtMjFhMy00ZDM0LWIxMTctYmM5YzE2NWMyNDMzXkEyXkFqcGdeQXVyNjEwOTQ0OTY@._V1_UX140_CR0,0,140,209_AL_.jpg",Movie,"['Tamera Mowry-Housley', 'Paul Campbell', 'Joe Pantoliano', 'Peter Bryant']","['Comedy', 'Crime', 'Drama']",0.6455696202531647,0.41919191919191917
A Christmas Proposal,PG,84.0,4.6,,"Comedy, Drama, Romance",2008.0,Two lawyers dueling over a proposal to turn a quaint mountain town into a ski resort discover that they are former childhood sweethearts. Lisa is fighting to protect the hamlet; big-city ...                See full summary »,Michael Feifer,"Nicole Eggert, David O'Donnell, Tom Arnold, David DeLuise, ",606,,"https://m.media-amazon.com/images/M/MV5BMTM2MDcyMTk5Ml5BMl5BanBnXkFtZTcwNzMzMDMyMw@@._V1_UY209_CR14,0,140,209_AL_.jpg",Movie,"['Nicole Eggert', ""David O'Donnell"", 'Tom Arnold', 'David DeLuise']","['Comedy', 'Drama', 'Romance']",0.4177215189873418,0.41919191919191917
