title,rating,runtime,imdb_rating,meta_score,genre,release_year,description,director,stars,votes,gross,img_src,type,stars_list,genre_list,rating_norm,runtime_norm
Reporting for Christmas,,86.0,5.7,,"Drama, Romance",2023.0,"When an idealistic reporter is assigned a puff piece about a Christmas toy manufacturer over the holidays, a charming toymaker inspires her to search her heart to find true happiness.",Jack C. Newell,"Tamara Feldman, Matt Trudeau, Kelvin John Davis, Suzanne C Johnson, ",331,,"https://m.media-amazon.com/images/M/MV5BYjc3NzgyZTQtZTYwMS00MzE1LTg3MmItOGMwN2U5YzAyMTNhXkEyXkFqcGdeQXVyMzMzMDQ3MzY@._V1_UY209_CR0,0,140,209_AL_.jpg",Movie,"['Tamara Feldman', 'Matt Trudeau', 'Kelvin John Davis', 'Suzanne C Johnson']","['Drama', 'Romance']",0.5569620253164558,0.4292929292929293
A Christmas Love Story,TV-G,84.0,6.9,,"Drama, Music, Romance",2019.0,"A youth choir director (Chenoweth) needs to write a big song for the Christmas Eve show but ""finds herself distracted"" when a boy with a golden voice (Kevin Quinn) joins her choir, which will come as news to his widowed father (Wolf).",Eric Close,"Kristin Chenoweth, Scott Wolf, Kevin Quinn, Keith D. Robinson, ","1,674",,"https://m.media-amazon.com/images/M/MV5BMDQ4MmJlOWQtNTJlOC00M2ZjLTk1N2YtMGM3NTY5ZDg1NDViXkEyXkFqcGdeQXVyNTQ2NjI3NDQ@._V1_UX140_CR0,0,140,209_AL_.jpg",Movie,"['Kristin Chenoweth', 'Scott Wolf', 'Kevin Quinn', 'Keith D. Robinson']","['Drama', 'Music', 'Romance']",0.708860759493671,0.41919191919191917
A Christmas Coincidence,TV-G,87.0,6.6,,"Drama, Romance",2018.0,A woman who accepts her boyfriend's marriage proposal is invited to her aunt's home for Christmas and develops romantic feelings for an inn owner.,Michael Robison,"Kimberley Sustad, Paul Campbell, Kathie Lee Gifford, Giles Panton, ","1,955",,"https://m.media-amazon.com/images/M/MV5BOTA3NTRjOGEtNGE2Yy00ZmRjLWJkNjctNzA2MGI3M2M1OWVmXkEyXkFqcGdeQXVyNTU2MDQyOTk@._V1_UX140_CR0,0,140,209_AL_.jpg",Movie,"['Kimberley Sustad', 'Paul Campbell', 'Kathie Lee Gifford', 'Giles Panton']","['Drama', 'Romance']",0.6708860759493671,0.43434343434343436
Snow Bride,TV-G,84.0,6.7,,"Comedy, Family, Romance",2013.0,"Greta Kaine (Katrina Law) is always in search of juicy gossip. As a gossip-tabloid reporter in Los Angeles, it's her job to expose the rich and famous. So when word gets out that the late ...                See full summary »",Bert Kish,"Katrina Law, Jordan Belfi, Patricia Richardson, Susie Abromeit, ","3,693",,"https://m.media-amazon.com/images/M/MV5BMjc4NmM1NzUtOTIwNy00MjQyLTgwY2MtZTQxNDA5M2U4ZTZkL2ltYWdlL2ltYWdlXkEyXkFqcGdeQXVyNjg5MzE4NTA@._V1_UX140_CR0,0,140,209_AL_.jpg",Movie,"['Katrina Law', 'Jordan Belfi', 'Patricia Richardson', 'Susie Abromeit']","['Comedy', 'Family', 'Romance']",0.6835443037974684,0.41919191919191917
Homegrown Christmas,TV-G,88.0,6.0,,Romance,2018.0,"After stepping down as CEO of her dream job, Maddie (Lori Loughlin) heads home for the holidays to gain perspective. She runs into her high-school sweetheart Carter (Victor Webster), and ...                See full summary »",Mel Damski,"Lori Loughlin, Victor Webster, Gwynyth Walsh, Isabella Giannulli, ","1,230",,"https://m.media-amazon.com/images/M/MV5BNWI4ODUxOTEtNzk1YS00ZTViLWJjZWMtNTI0ZDZmYTI4YjkzXkEyXkFqcGdeQXVyNjg1Mjc3MDg@._V1_UX140_CR0,0,140,209_AL_.jpg",Movie,"['Lori Loughlin', 'Victor Webster', 'Gwynyth Walsh', 'Isabella Giannulli']",['Romance'],0.5949367088607596,0.4393939393939394
Blending Christmas,TV-PG,85.0,5.4,,"Comedy, Drama, Family",2021.0,The holiday season is in full swing when Emma learns that the resort where she used to spend Christmases with her family is being redeveloped.,Marla Sokoloff,"Haylie Duff, Aaron O'Connell, Christopher Knight, Mike Lookinland, ",507,,"https://m.media-amazon.com/images/M/MV5BNDYxZDgwN2EtOGZiYS00NDZlLThlOWEtMzI3ZWFjMmI2YTRhXkEyXkFqcGdeQXVyMTU0NjY0NDg@._V1_UY209_CR36,0,140,209_AL_.jpg",Movie,"['Haylie Duff', ""Aaron O'Connell"", 'Christopher Knight', 'Mike Lookinland']","['Comedy', 'Drama', 'Family']",0.518987341772152,0.42424242424242425
The Best Man Holiday,R,123.0,6.6,59.0,"Comedy, Drama",2013.0,"When college friends reunite after 15 years over the Christmas holidays, they discover just how easy it is for long-forgotten rivalries and romances to be reignited.",Malcolm D. Lee,"Monica Calhoun, Morris Chestnut, Melissa De Sousa, Taye Diggs, ","16,694",$70.53M,"https://m.media-amazon.com/images/M/MV5BMjU0MTI1MDg5Ml5BMl5BanBnXkFtZTgwNzc2MTMzMDE@._V1_UX140_CR0,0,140,209_AL_.jpg",Movie,"['Monica Calhoun', 'Morris Chestnut', 'Melissa De Sousa', 'Taye Diggs']","['Comedy', 'Drama']",0.6708860759493671,0.6161616161616161
A Bride for Christmas,TV-G,84.0,6.5,,"Comedy, Romance",2012.0,A single man tries to win a bet by getting a woman recovering from a broken engagement to marry him by Christmas.,Gary Yates,"Arielle Kebbel, Andrew W. Walker, Kimberley Sustad, Sage Brocklebank, ","4,595",,"https://m.media-amazon.com/images/M/MV5BY2IxMGNhMDMtNWQ4OC00ODA0LThkZjctYjUwNzljM2M0YjY2XkEyXkFqcGdeQXVyNjg5MzE4NTA@._V1_UX140_CR0,0,140,209_AL_.jpg",Movie,"['Arielle Kebbel', 'Andrew W. Walker', 'Kimberley Sustad', 'Sage Brocklebank']","['Comedy', 'Romance']",0.6582278481012659,0.41919191919191917
A Taste of Christmas,TV-PG,91.0,5.5,,"Comedy, Romance",2020.0,"When Natalie learns her cousin Francesca must cancel the Christmas Eve opening of her new Italian restaurant, Natalie's heart goes out to all of the guests who were planning on attending.",Damián Romay,"Anni Krueger, Gilles Marini, Nia Vardalos, Emma Myers, ",625,,"https://m.media-amazon.com/images/M/MV5BMTljNDU1MzMtOGRkMC00NGEwLTliNzctODQ0NDRhYTJjMWVmXkEyXkFqcGdeQXVyNTYxMjExMzY@._V1_UY209_CR3,0,140,209_AL_.jpg",Movie,"['Anni Krueger', 'Gilles Marini', 'Nia Vardalos', 'Emma Myers']","['Comedy', 'Romance']",0.5316455696202532,0.45454545454545453
A Veteran's Christmas,TV-G,84.0,7.0,,"Drama, Romance",2018.0,"After receiving an honorable discharge, a former Marine suffers a minor car accident which strands her in a small town for the Christmas season.",Mark Jean,"Sean Faris, Eloise Mumford, Mary Long, Amanda Lisman, ","2,305",,"https://m.media-amazon.com/images/M/MV5BYzk5MWNhODctMDY3MS00NzZhLWExMzgtMmZmMTM4ZGRhYjYyXkEyXkFqcGdeQXVyODMwMzc1MjU@._V1_UX140_CR0,0,140,209_AL_.jpg",Movie,"['Sean Faris', 'Eloise Mumford', 'Mary Long', 'Amanda Lisman']","['Drama', 'Romance']",0.7215189873417722,0.41919191919191917
Christmas on the Farm,,86.0,5.2,,"Comedy, Drama, Romance",2021.0,A romantic comedy about a New York socialite who fakes her identity to get her book published and has to rush back to her deceased mother's farm when the publisher and her son come to visit their 'Australian' author.,Christopher Weekes,"Poppy Montgomery, Darren McMullen, Hugh Sheridan, Nicholas Brown, ",942,,"https://m.media-amazon.com/images/M/MV5BZmMwNzliNjItNDdmNi00NzA4LWE4MmItYmJmZTQ2NzkwODYwXkEyXkFqcGdeQXVyMTQ2Mzk5NTYz._V1_UX140_CR0,0,140,209_AL_.jpg",Movie,"['Poppy Montgomery', 'Darren McMullen', 'Hugh Sheridan', 'Nicholas Brown']","['Comedy', 'Drama', 'Romance']",0.49367088607594944,0.4292929292929293
Christmas by Design,,84.0,6.1,,"Comedy, Drama, Romance",2023.0,A fashion designer learns what's most important in life when she joins a Christmas challenge to create a new holiday-themed collection.,Max McGuire,"Rebecca Dalton, Jonathan Keltz, Joanna Douglas, Susan Hamann, ",658,,"https://m.media-amazon.com/images/M/MV5BMTAxNDY0YmItNGJhOC00YWNhLWJjMTctZmIxNTE4M2U1ZTJkXkEyXkFqcGdeQXVyMzA1Mjc2Ng@@._V1_UX140_CR0,0,140,209_AL_.jpg",Movie,"['Rebecca Dalton', 'Jonathan Keltz', 'Joanna Douglas', 'Susan Hamann']","['Comedy', 'Drama', 'Romance']",0.6075949367088608,0.41919191919191917
A Holiday Spectacular,TV-G,85.0,7.2,,"Comedy, Drama, Romance",2022.0,"Set in 1958, follows Maggie who sneaks up to New York City to make her secret dream come true: dancing live on stage in the Christmas Spectacular at Radio City Music Hall, putting her high-society wedding plans on hold.",John Putch,"Ginna Claire Mason, Derek Klena, Sara Gallo, Tiffany Denise Hobbs, ","1,269",,"https://m.media-amazon.com/images/M/MV5BMWJlMzgxMjctMzJkYS00YzM3LWE1NjUtZGU1ODFlNWVjMjBiXkEyXkFqcGdeQXVyNjc3Mzg2ODY@._V1_UX140_CR0,0,140,209_AL_.jpg",Movie,"['Ginna Claire Mason', 'Derek Klena', 'Sara Gallo', 'Tiffany Denise Hobbs']","['Comedy', 'Drama', 'Romance']",0.7468354430379748,0.42424242424242425
Family for Christmas,TV-G,85.0,6.2,,"Drama, Family, Fantasy",2015.0,"After a conversation with a man playing Santa Claus during her office Christmas party, a woman wakes up to find herself married to her college sweetheart with two kids, and questions her life choices.",Amanda Tapping,"Lacey Chabert, Tyron Leitso, Milli Wilkinson, Audrey Smallman, ","2,581",,"https://m.media-amazon.com/images/M/MV5BOWQ4Yjg2NTgtZTk4Ni00YjIzLWJhYzUtYWMzOWU3YmQ1NjkyXkEyXkFqcGdeQXVyODE4NjAwNjk@._V1_UX140_CR0,0,140,209_AL_.jpg",Movie,"['Lacey Chabert', 'Tyron Leitso', 'Milli Wilkinson', 'Audrey Smallman']","['Drama', 'Family', 'Fantasy']",0.6202531645569621,0.42424242424242425
A Big Fat Family Christmas,TV-G,85.0,6.5,,"Comedy, Drama, Romance",2022.0,Liv gets an assignment to photograph the Chang family's annual holiday party for a front-page story--nobody at work knows that they are her family. She wants to confide in new co-worker Henry but doesn't want to jeopardize her big break.,Jennifer Liao,"Shannon Chan-Kent, Shannon Kook, Tia Carrere, Yee Jee Tso, ",798,,"https://m.media-amazon.com/images/M/MV5BNDkyNzllNjEtMDdiMi00ODA0LTliYmQtMjU0ZTViZDkwZjg0XkEyXkFqcGdeQXVyMTU4MzQzNDkx._V1_UX140_CR0,0,140,209_AL_.jpg",Movie,"['Shannon Chan-Kent', 'Shannon Kook', 'Tia Carrere', 'Yee Jee Tso']","['Comedy', 'Drama', 'Romance']",0.6582278481012659,0.42424242424242425
Christmas Land,TV-G,84.0,5.8,,"Comedy, Drama, Family",2015.0,"After inheriting a Christmas tree farm, a woman's plans to sell it change when she falls in love with the townspeople and meets a charming lawyer named Tucker.",Sam Irvin,"Nikki Deloach, Luke Macfarlane, Jason-Shane Scott, Maureen McCormick, ","2,932",,"https://m.media-amazon.com/images/M/MV5BMTUwMzk3NTkzMF5BMl5BanBnXkFtZTgwNjc1Njk0NzE@._V1_UX140_CR0,0,140,209_AL_.jpg",Movie,"['Nikki Deloach', 'Luke Macfarlane', 'Jason-Shane Scott', 'Maureen McCormick']","['Comedy', 'Drama', 'Family']",0.569620253164557,0.41919191919191917
No Sleep 'Til Christmas,TV-14,90.0,6.5,,"Comedy, Romance",2018.0,A bartender and a businesswoman find they only have one thing in common; insomnia.,Phil Traill,"Odette Annable, Dave Annable, Charles Michael Davis, Alphonso McAuley, ","3,002",,"https://m.media-amazon.com/images/M/MV5BNjViODZmZDQtYTE1ZC00NmE0LTllZWEtYjBhMmQzZmUwNzNiXkEyXkFqcGdeQXVyNTM3MDMyMDQ@._V1_UY209_CR8,0,140,209_AL_.jpg",Movie,"['Odette Annable', 'Dave Annable', 'Charles Michael Davis', 'Alphonso McAuley']","['Comedy', 'Romance']",0.6582278481012659,0.4494949494949495
March of the Wooden Soldiers,Passed,77.0,7.1,,"Comedy, Family, Fantasy",1934.0,"Opposing the evil Barnaby, Ollie Dee and Stanley Dum try and fail to pay-off Mother Peep's mortgage and mislead his attempts to marry Little Bo. Enraged, Barnaby's Bogeymen are set on Toyland.",Gus Meins,"Charley Rogers, Stan Laurel, Oliver Hardy, Virginia Karns, Charlotte Henry, ","7,433",,"https://m.media-amazon.com/images/M/MV5BZTYxNzA3ZDUtYTM2MC00MmM5LThmNzUtMDgzZWJmYjcyNTc1XkEyXkFqcGdeQXVyNjMwMjk0MTQ@._V1_UX140_CR0,0,140,209_AL_.jpg",Movie,"['Charley Rogers', 'Stan Laurel', 'Oliver Hardy', 'Virginia Karns', 'Charlotte Henry']","['Comedy', 'Family', 'Fantasy']",0.7341772151898734,0.3838383838383838
A Christmas Miracle for Daisy,,85.0,5.9,,Romance,2021.0,"Whitney (Wagner) owns Marietta Designs, an interior-design firm which she runs with her friend Andi (Tegan Moss). She's designing Santa's float for the town's annual Christmas parade when a...                See full summary »",Mike Rohl,"Jill Wagner, Nick Bateman, Rubi Tupper, Tegan Moss, ","2,714",,"https://m.media-amazon.com/images/M/MV5BY2Q1MjgwY2EtNTM0Yi00ODJhLWEzZjItZjkzMDUxMWNmOGRhXkEyXkFqcGdeQXVyMjIzOTA2NDk@._V1_UY209_CR8,0,140,209_AL_.jpg",Movie,"['Jill Wagner', 'Nick Bateman', 'Rubi Tupper', 'Tegan Moss']",['Romance'],0.5822784810126583,0.42424242424242425
Chateau Christmas,TV-G,84.0,6.4,,"Comedy, Drama, Music",2020.0,"World-famous pianist Margot returns to Chateau Neuhaus for Christmas. While there she reunites with her ex-boyfriend Jackson, who convinces her to headline their annual Christmas Concert.",Michael Robison,"Merritt Patterson, Luke Macfarlane, Jesse Hutch, Julia Benson, ","1,888",,"https://m.media-amazon.com/images/M/MV5BMzhjMmI5YWYtNDhjOC00ZmE0LTljNGYtOWU0YWU3YWNlMDFkXkEyXkFqcGdeQXVyNjU0NTI0Nw@@._V1_UX140_CR0,0,140,209_AL_.jpg",Movie,"['Merritt Patterson', 'Luke Macfarlane', 'Jesse Hutch', 'Julia Benson']","['Comedy', 'Drama', 'Music']",0.6455696202531647,0.41919191919191917
The Mistle-Tones,TV-PG,90.0,6.4,,"Comedy, Family, Music",2012.0,A talented singer forms a musical group and challenges her rivals to a competition on Christmas Eve.,Paul Hoen,"Tia Mowry, Jonathan Patrick Moore, Andy Gala, Megan Kathleen Duffy, ","2,493",,"https://m.media-amazon.com/images/M/MV5BMTQ2ODYyMzI0N15BMl5BanBnXkFtZTgwMzkzOTAxMzE@._V1_UY209_CR8,0,140,209_AL_.jpg",Movie,"['Tia Mowry', 'Jonathan Patrick Moore', 'Andy Gala', 'Megan Kathleen Duffy']","['Comedy', 'Family', 'Music']",0.6455696202531647,0.4494949494949495
A Fabled Holiday,TV-G,84.0,6.6,,"Comedy, Drama, Romance",2022.0,Talia and her childhood best friend Anderson reunite in a curiously familiar-looking town full of Christmas spirit that restores its visitors when they need it most.,Ruby J. Munro,"Brooke D'Orsay, Ryan Paevey, John Prowse, Carmel Amit, ","1,200",,"https://m.media-amazon.com/images/M/MV5BY2E3OGJkZDktOWUxMC00ODFiLTkwNGItYzQ3ZTI0YzYxZGQ4XkEyXkFqcGdeQXVyMjAwNzczNTU@._V1_UX140_CR0,0,140,209_AL_.jpg",Movie,"[""Brooke D'Orsay"", 'Ryan Paevey', 'John Prowse', 'Carmel Amit']","['Comedy', 'Drama', 'Romance']",0.6708860759493671,0.41919191919191917
The Sweetest Christmas,TV-G,90.0,6.3,,"Comedy, Drama, Romance",2017.0,"Kylie is expecting a proposal from her boyfriend/boss at a restaurant and gets a promotion instead. The restaurant owner is her old high school boyfriend, she hasn't seen in years. They help each other out. Love in the air?",Terry Ingram,"Lacey Chabert, Lea Coco, Jonathan Adams, Brenden Sunderland, ","2,640",,"https://m.media-amazon.com/images/M/MV5BZTgxM2MzMjEtMjc5OC00NTcwLTljNTMtNzI2ZThhY2FlNjE3XkEyXkFqcGdeQXVyNTU2MDQyOTk@._V1_UX140_CR0,0,140,209_AL_.jpg",Movie,"['Lacey Chabert', 'Lea Coco', 'Jonathan Adams', 'Brenden Sunderland']","['Comedy', 'Drama', 'Romance']",0.6329113924050633,0.4494949494949495
Christmas Cupid,PG-13,85.0,5.4,,"Comedy, Fantasy, Romance",2010.0,A supernatural comedy in which a ruthless PR executive is forced to reconsider her life choices when her number one client suffers an untimely death during the Christmas season.,Gil Junger,"Christina Milian, Kenny Alfonso, Cynthia Evans, Burgess Jenkins, ","4,059",,"https://m.media-amazon.com/images/M/MV5BZWFkMzM5YTctY2Y1YS00MzhlLTg4MjktYmJhYTkxNTk5OTNiL2ltYWdlXkEyXkFqcGdeQXVyNTM3MDMyMDQ@._V1_UY209_CR8,0,140,209_AL_.jpg",Movie,"['Christina Milian', 'Kenny Alfonso', 'Cynthia Evans', 'Burgess Jenkins']","['Comedy', 'Fantasy', 'Romance']",0.518987341772152,0.42424242424242425
A Christmas Prince: The Royal Wedding,TV-PG,92.0,5.3,,"Comedy, Drama, Romance",2018.0,"A year after helping Richard get to the throne, Amber is about to become his wife. But is she really made to be queen?",John Schultz,"Rose McIver, Ben Lamb, Alice Krige, Honor Kneafsey, ","11,765",,"https://m.media-amazon.com/images/M/MV5BMWVhMTBiOWUtMmI0Ni00NDg1LWFkMmYtNTJkNTkxNWE5OWY5XkEyXkFqcGdeQXVyMTMxODk2OTU@._V1_UY209_CR0,0,140,209_AL_.jpg",Movie,"['Rose McIver', 'Ben Lamb', 'Alice Krige', 'Honor Kneafsey']","['Comedy', 'Drama', 'Romance']",0.5063291139240507,0.4595959595959596
Small Town Christmas,TV-G,85.0,6.7,,"Comedy, Drama, Romance",2018.0,A high-flying female novelist from New York takes a trip to the small town that inspired her latest best-seller.,Maclain Nelson,"Ashley Newbrough, Kristoffer Polaha, Preston Vanderslice, Bailey Skodje, ","1,932",,"https://m.media-amazon.com/images/M/MV5BMmU3YjYyZjctYmU2YS00MTllLWJhOGYtNjBhYjRlNGI2OWU1XkEyXkFqcGdeQXVyODY0NzcxNw@@._V1_UY209_CR8,0,140,209_AL_.jpg",Movie,"['Ashley Newbrough', 'Kristoffer Polaha', 'Preston Vanderslice', 'Bailey Skodje']","['Comedy', 'Drama', 'Romance']",0.6835443037974684,0.42424242424242425
Scrooge,PG,78.0,6.4,,"Drama, Family, Fantasy",1935.0,"Ebenezer Scrooge is a mean old miser who wants nothing to do with Christmas. The Ghosts of Christmas Past, Present and Yet to Come visit Scrooge on Christmas Eve, taking him on a journey into the very spirit and magic of Christmas itself.",Henry Edwards,"Seymour Hicks, Donald Calthrop, Robert Cochran, Mary Glynne, ","2,553",,"https://m.media-amazon.com/images/M/MV5BNmQ3MzAxZjgtYTM5YS00YWNkLWE3ZTMtMGI4YWJiMWFmMDY3XkEyXkFqcGdeQXVyNjUwMzI2NzU@._V1_UY209_CR2,0,140,209_AL_.jpg",Movie,"['Seymour Hicks', 'Donald Calthrop', 'Robert Cochran', 'Mary Glynne']","['Drama', 'Family', 'Fantasy']",0.6455696202531647,0.3888888888888889
A Christmas Wish,TV-PG,90.0,6.3,,"Comedy, Drama, Family",2019.0,"Maddie slips in a wish that her sister Faith will experience true love for the first time. The next day, Faith meets seemingly-perfect Andrew, but is he really the one for her?",Emily Moss Wilson,"Hilarie Burton, Tyler Hilton, Megan Park, Lee Norris, ","1,081",,"https://m.media-amazon.com/images/M/MV5BNmMwZDdjNDItZDk0Zi00YjNiLThlZDktMDlmNzNiN2YyNzE1XkEyXkFqcGdeQXVyNTQ2NjI3NDQ@._V1_UY209_CR0,0,140,209_AL_.jpg",Movie,"['Hilarie Burton', 'Tyler Hilton', 'Megan Park', 'Lee Norris']","['Comedy', 'Drama', 'Family']",0.6329113924050633,0.4494949494949495
Jingle Bell Princess,,84.0,6.5,,Romance,2021.0,"Through a series of mishaps, sophisticated Princess Amelia is stranded in the small town of Tucker, Maine. There she becomes an ""ordinary"" guest of the unsuspecting Cutler family.",Don McBrearty,"Merritt Patterson, Trevor Donovan, Charlie Boyle, Marnie McPhail, ","1,169",,"https://m.media-amazon.com/images/M/MV5BNTE0NWZjODktN2I5My00YjFhLTkzNDEtOTkxZmYwNWJhMjIzXkEyXkFqcGdeQXVyNjU0NTI0Nw@@._V1_UY209_CR8,0,140,209_AL_.jpg",Movie,"['Merritt Patterson', 'Trevor Donovan', 'Charlie Boyle', 'Marnie McPhail']",['Romance'],0.6582278481012659,0.41919191919191917
A Shoe Addict's Christmas,TV-G,85.0,6.6,,"Fantasy, Romance",2018.0,Noelle's life stopped when her boyfriend broke up with her on Christmas Eve three years ago. A handsome fireman moves in above her. She gets locked in at work in a department store all alone save the ghost of Christmas past.,Michael Robison,"Candace Cameron Bure, Luke Macfarlane, Jean Smart, Tenika Davis, ","3,000",,"https://m.media-amazon.com/images/M/MV5BY2U0MzVlMDMtZWFjNy00ZDVlLTgwNDgtMzY3OTdmYWZiMzEyXkEyXkFqcGdeQXVyODA4MzkyNjM@._V1_UX140_CR0,0,140,209_AL_.jpg",Movie,"['Candace Cameron Bure', 'Luke Macfarlane', 'Jean Smart', 'Tenika Davis']","['Fantasy', 'Romance']",0.6708860759493671,0.42424242424242425
Falling for Christmas,TV-G,87.0,6.2,,"Drama, Romance, Sport",2016.0,"An injured figure skater is sent to the mountains to recover from an injury. Once there, she meets an ex-hockey player and his young daughter and begins to realize that something is missing from her life.",Christie Will Wolf,"Leah Renee, Niall Matter, Lisa Whelchel, Michael Teigen, ","1,672",,"https://m.media-amazon.com/images/M/MV5BNmJjODA0YjItMDBlMy00NzA5LTk4ODQtNzhkMzZmNDZkMThjXkEyXkFqcGdeQXVyMzE1MDA4Nw@@._V1_UY209_CR11,0,140,209_AL_.jpg",Movie,"['Leah Renee', 'Niall Matter', 'Lisa Whelchel', 'Michael Teigen']","['Drama', 'Romance', 'Sport']",0.6202531645569621,0.43434343434343436
Debbie Macomber's Dashing Through the Snow,Not Rated,83.0,6.5,,"Comedy, Family, Romance",2015.0,"Stranded at an airport at Christmastime, Ashley Jane Harrison accepts a ride from Dash Sutherland, who has just rented the last car in town. As the pair heads north, their adventures include car trouble.",Kristoffer Tabori,"Meghan Ory, Andrew W. Walker, Aaron Craven, Rukiya Bernard, ","2,684",,"https://m.media-amazon.com/images/M/MV5BODllYzk0MWEtM2E0Yy00Y2I2LTk1NDEtMGYxYTFiNGViNWQ1L2ltYWdlL2ltYWdlXkEyXkFqcGdeQXVyNjg5MzE4NTA@._V1_UX140_CR0,0,140,209_AL_.jpg",Movie,"['Meghan Ory', 'Andrew W. Walker', 'Aaron Craven', 'Rukiya Bernard']","['Comedy', 'Family', 'Romance']",0.6582278481012659,0.41414141414141414
The Flight Before Christmas,TV-PG,88.0,5.9,,"Comedy, Romance",2015.0,"Two strangers who both happen to be in marketing, share a room at a bed-and-breakfast when a snowstorm strands their flight in Montana on Christmas Eve.",Peter Sullivan,"Mayim Bialik, Ryan McPartlin, Reginald VelJohnson, Jo Marie Payton, ","2,035",,"https://m.media-amazon.com/images/M/MV5BM2YyNzJjMTEtODg2Mi00YzAxLWI2YzktY2M4MjVjMTM5ZDY5L2ltYWdlL2ltYWdlXkEyXkFqcGdeQXVyNjg5MzE4NTA@._V1_UX140_CR0,0,140,209_AL_.jpg",Movie,"['Mayim Bialik', 'Ryan McPartlin', 'Reginald VelJohnson', 'Jo Marie Payton']","['Comedy', 'Romance']",0.5822784810126583,0.4393939393939394
Christmas in Evergreen,TV-G,84.0,6.5,,"Drama, Family, Fantasy",2017.0,"Hoping to spur her longtime beau to action, a small-town veterinarian wishes upon a snow globe that this will be her most romantic Christmas ever.",Alex Zamm,"Ashley Williams, Teddy Sears, Holly Robinson Peete, Jaeda Lily Miller, ","3,024",,"https://m.media-amazon.com/images/M/MV5BOWI1MGMyZTQtMTFmZC00MmE4LTk2OGYtNzg2MTI0ZmExMTlkXkEyXkFqcGdeQXVyODA4MzkyNjM@._V1_UX140_CR0,0,140,209_AL_.jpg",Movie,"['Ashley Williams', 'Teddy Sears', 'Holly Robinson Peete', 'Jaeda Lily Miller']","['Drama', 'Family', 'Fantasy']",0.6582278481012659,0.41919191919191917
Time for Me to Come Home for Christmas,TV-G,84.0,6.6,,"Comedy, Drama, Music",2018.0,"When strangers Cara and Heath are stranded before Christmas, they embark on an unexpected journey that may give them the miracles they've been hoping for.",David Winning,"Josh Henderson, Megan Park, Lindsay Maxwell, Paul McGillion, ","1,785",,"https://m.media-amazon.com/images/M/MV5BNGI4YWQ5MjMtMjMxZS00ZTBiLWE5NGItZWNmYTlkNTcwNGRiXkEyXkFqcGdeQXVyNjk2Mjc2OTI@._V1_UX140_CR0,0,140,209_AL_.jpg",Movie,"['Josh Henderson', 'Megan Park', 'Lindsay Maxwell', 'Paul McGillion']","['Comedy', 'Drama', 'Music']",0.6708860759493671,0.41919191919191917
A Season for Miracles,G,100.0,7.6,,"Drama, Romance",1999.0,A miracle occurs for a homeless family consisting of two children neglected by their incarcerated mother and their protective aunt who is trying to keep them out of the foster system with the help of an angel.,Michael Pressman,"Carla Gugino, Kathy Baker, David Conrad, Laura Dern, ","1,873",,"https://m.media-amazon.com/images/M/MV5BMmE3MmY4NmMtMzk0OS00YmQ5LWE5OTEtMmNjZGU0ZjVlNmVjXkEyXkFqcGdeQXVyNTM3MDMyMDQ@._V1_UY209_CR8,0,140,209_AL_.jpg",Movie,"['Carla Gugino', 'Kathy Baker', 'David Conrad', 'Laura Dern']","['Drama', 'Romance']",0.7974683544303798,0.5
The Nine Lives of Christmas,TV-G,86.0,7.2,,"Comedy, Drama, Family",2014.0,"After a stray cat adopts Zachary, he meets Marilee and realizes the single life is not as fulfilling as he thought it was.",Mark Jean,"Brandon Routh, Kimberley Sustad, Stephanie Bennett, Chelsea Hobbs, ","4,423",,"https://m.media-amazon.com/images/M/MV5BMmE0NDEzOGMtMjZhYS00YTY0LWEzMzQtNTA2MTVkZDNlZGU4XkEyXkFqcGdeQXVyNjg5MzE4NTA@._V1_UX140_CR0,0,140,209_AL_.jpg",Movie,"['Brandon Routh', 'Kimberley Sustad', 'Stephanie Bennett', 'Chelsea Hobbs']","['Comedy', 'Drama', 'Family']",0.7468354430379748,0.4292929292929293
"Nativity 3: Dude, Where's My Donkey?!",,109.0,3.6,,"Comedy, Family",2014.0,"The pupils of St Bernadette's and the madcap Mr Poppy are back. When their new teacher Mr Shepherd loses his memory as well as Archie the Donkey, it's up to them to save the day and reunite him with his fiancée Sophie in New York.",Debbie Isitt,"Martin Clunes, Marc Wootton, Catherine Tate, Adam Garcia, ","2,052",,"https://m.media-amazon.com/images/M/MV5BMTUxOTQ1NTgyOF5BMl5BanBnXkFtZTgwMzAxMzU4MjE@._V1_UY209_CR0,0,140,209_AL_.jpg",Movie,"['Martin Clunes', 'Marc Wootton', 'Catherine Tate', 'Adam Garcia']","['Comedy', 'Family']",0.2911392405063291,0.5454545454545454
Every Christmas Has a Story,TV-G,82.0,6.1,,"Comedy, Romance",2016.0,"While on air, a TV personality accidentally admits she hates Christmas. When she goes to a small town to film a special to repair her image, the Christmas spirit begins to change her life.",Ron Oliver,"Lori Loughlin, Colin Ferguson, Willie Aames, Catherine Lough Haggquist, ","1,939",,"https://m.media-amazon.com/images/M/MV5BMjZmOGRlZWEtYjIxOS00MWRmLTkwYWEtNjNmYmRjZWQ4ZWIzXkEyXkFqcGdeQXVyNjg5MzE4NTA@._V1_UX140_CR0,0,140,209_AL_.jpg",Movie,"['Lori Loughlin', 'Colin Ferguson', 'Willie Aames', 'Catherine Lough Haggquist']","['Comedy', 'Romance']",0.6075949367088608,0.4090909090909091
The Christmas Contract,TV-PG,87.0,6.8,,"Drama, Family, Romance",2018.0,A recently-single woman dreads the thought of going back to her Louisiana hometown for Christmas when she finds out that her ex-boyfriend will be there with his new girlfriend.,Monika Mitchell,"Hilarie Burton, Robert Buckley, Danneel Ackles, Antwon Tanner, ","2,836",,"https://m.media-amazon.com/images/M/MV5BYzk2MmYzMjAtNTZhMi00MDgxLThkZWUtZTRmZGZmOTVkMDNlXkEyXkFqcGdeQXVyODY0NzcxNw@@._V1_UY209_CR8,0,140,209_AL_.jpg",Movie,"['Hilarie Burton', 'Robert Buckley', 'Danneel Ackles', 'Antwon Tanner']","['Drama', 'Family', 'Romance']",0.6962025316455697,0.43434343434343436
